output_path,date_string,date_iso,seed,tier,generator_type,model_checkpoint
stress_runs\20260120_084954\images\2026\01\20_seed40870.png,01/20/2026,2026-01-20,40870,B,handwriting_gan,pytorch_handwriting_gan
stress_runs\20260120_084954\images\2026\01\20_seed40871.png,01/20/2026,2026-01-20,40871,B,handwriting_gan,pytorch_handwriting_gan
stress_runs\20260120_084954\images\2026\01\20_seed40872.png,01/20/2026,2026-01-20,40872,B,handwriting_gan,pytorch_handwriting_gan
stress_runs\20260120_084954\images\2026\01\21_seed40871.png,01/21/2026,2026-01-21,40871,B,handwriting_gan,pytorch_handwriting_gan
stress_runs\20260120_084954\images\2026\01\21_seed40872.png,01/21/2026,2026-01-21,40872,B,handwriting_gan,pytorch_handwriting_gan
stress_runs\20260120_084954\images\2026\01\21_seed40873.png,01/21/2026,2026-01-21,40873,B,handwriting_gan,pytorch_handwriting_gan
stress_runs\20260120_084954\images\2026\01\22_seed40872.png,01/22/2026,2026-01-22,40872,B,handwriting_gan,pytorch_handwriting_gan
stress_runs\20260120_084954\images\2026\01\22_seed40873.png,01/22/2026,2026-01-22,40873,B,handwriting_gan,pytorch_handwriting_gan
stress_runs\20260120_084954\images\2026\01\22_seed40874.png,01/22/2026,2026-01-22,40874,B,handwriting_gan,pytorch_handwriting_gan
stress_runs\20260120_084954\images\2026\01\23_seed40873.png,01/23/2026,2026-01-23,40873,B,handwriting_gan,pytorch_handwriting_gan
stress_runs\20260120_084954\images\2026\01\23_seed40874.png,01/23/2026,2026-01-23,40874,B,handwriting_gan,pytorch_handwriting_gan
stress_runs\20260120_084954\images\2026\01\23_seed40875.png,01/23/2026,2026-01-23,40875,B,handwriting_gan,pytorch_handwriting_gan
stress_runs\20260120_084954\images\2026\01\24_seed40874.png,01/24/2026,2026-01-24,40874,B,handwriting_gan,pytorch_handwriting_gan
stress_runs\20260120_084954\images\2026\01\24_seed40875.png,01/24/2026,2026-01-24,40875,B,handwriting_gan,pytorch_handwriting_gan
stress_runs\20260120_084954\images\2026\01\24_seed40876.png,01/24/2026,2026-01-24,40876,B,handwriting_gan,pytorch_handwriting_gan
stress_runs\20260120_084954\images\2026\01\25_seed40875.png,01/25/2026,2026-01-25,40875,B,handwriting_gan,pytorch_handwriting_gan
stress_runs\20260120_084954\images\2026\01\25_seed40876.png,01/25/2026,2026-01-25,40876,B,handwriting_gan,pytorch_handwriting_gan
stress_runs\20260120_084954\images\2026\01\25_seed40877.png,01/25/2026,2026-01-25,40877,B,handwriting_gan,pytorch_handwriting_gan
stress_runs\20260120_084954\images\2026\01\26_seed40876.png,01/26/2026,2026-01-26,40876,B,handwriting_gan,pytorch_handwriting_gan
stress_runs\20260120_084954\images\2026\01\26_seed40877.png,01/26/2026,2026-01-26,40877,B,handwriting_gan,pytorch_handwriting_gan
stress_runs\20260120_084954\images\2026\01\26_seed40878.png,01/26/2026,2026-01-26,40878,B,handwriting_gan,pytorch_handwriting_gan
stress_runs\20260120_084954\images\2026\01\27_seed40877.png,01/27/2026,2026-01-27,40877,B,handwriting_gan,pytorch_handwriting_gan
stress_runs\20260120_084954\images\2026\01\27_seed40878.png,01/27/2026,2026-01-27,40878,B,handwriting_gan,pytorch_handwriting_gan
stress_runs\20260120_084954\images\2026\01\27_seed40879.png,01/27/2026,2026-01-27,40879,B,handwriting_gan,pytorch_handwriting_gan
stress_runs\20260120_084954\images\2026\01\28_seed40878.png,01/28/2026,2026-01-28,40878,B,handwriting_gan,pytorch_handwriting_gan
stress_runs\20260120_084954\images\2026\01\28_seed40879.png,01/28/2026,2026-01-28,40879,B,handwriting_gan,pytorch_handwriting_gan
stress_runs\20260120_084954\images\2026\01\28_seed40880.png,01/28/2026,2026-01-28,40880,B,handwriting_gan,pytorch_handwriting_gan
stress_runs\20260120_084954\images\2026\01\29_seed40879.png,01/29/2026,2026-01-29,40879,B,handwriting_gan,pytorch_handwriting_gan
stress_runs\20260120_084954\images\2026\01\29_seed40880.png,01/29/2026,2026-01-29,40880,B,handwriting_gan,pytorch_handwriting_gan
stress_runs\20260120_084954\images\2026\01\29_seed40881.png,01/29/2026,2026-01-29,40881,B,handwriting_gan,pytorch_handwriting_gan
stress_runs\20260120_084954\images\2026\01\30_seed40880.png,01/30/2026,2026-01-30,40880,B,handwriting_gan,pytorch_handwriting_gan
stress_runs\20260120_084954\images\2026\01\30_seed40881.png,01/30/2026,2026-01-30,40881,B,handwriting_gan,pytorch_handwriting_gan
stress_runs\20260120_084954\images\2026\01\30_seed40882.png,01/30/2026,2026-01-30,40882,B,handwriting_gan,pytorch_handwriting_gan
stress_runs\20260120_084954\images\2026\01\31_seed40881.png,01/31/2026,2026-01-31,40881,B,handwriting_gan,pytorch_handwriting_gan
stress_runs\20260120_084954\images\2026\01\31_seed40882.png,01/31/2026,2026-01-31,40882,B,handwriting_gan,pytorch_handwriting_gan
stress_runs\20260120_084954\images\2026\01\31_seed40883.png,01/31/2026,2026-01-31,40883,B,handwriting_gan,pytorch_handwriting_gan
stress_runs\20260120_084954\images\2026\02\01_seed40882.png,02/01/2026,2026-02-01,40882,B,handwriting_gan,pytorch_handwriting_gan
stress_runs\20260120_084954\images\2026\02\01_seed40883.png,02/01/2026,2026-02-01,40883,B,handwriting_gan,pytorch_handwriting_gan
stress_runs\20260120_084954\images\2026\02\01_seed40884.png,02/01/2026,2026-02-01,40884,B,handwriting_gan,pytorch_handwriting_gan
stress_runs\20260120_084954\images\2026\02\02_seed40883.png,02/02/2026,2026-02-02,40883,B,handwriting_gan,pytorch_handwriting_gan
stress_runs\20260120_084954\images\2026\02\02_seed40884.png,02/02/2026,2026-02-02,40884,B,handwriting_gan,pytorch_handwriting_gan
stress_runs\20260120_084954\images\2026\02\02_seed40885.png,02/02/2026,2026-02-02,40885,B,handwriting_gan,pytorch_handwriting_gan
stress_runs\20260120_084954\images\2026\02\03_seed40884.png,02/03/2026,2026-02-03,40884,B,handwriting_gan,pytorch_handwriting_gan
stress_runs\20260120_084954\images\2026\02\03_seed40885.png,02/03/2026,2026-02-03,40885,B,handwriting_gan,pytorch_handwriting_gan
stress_runs\20260120_084954\images\2026\02\03_seed40886.png,02/03/2026,2026-02-03,40886,B,handwriting_gan,pytorch_handwriting_gan
stress_runs\20260120_084954\images\2026\02\04_seed40885.png,02/04/2026,2026-02-04,40885,B,handwriting_gan,pytorch_handwriting_gan
stress_runs\20260120_084954\images\2026\02\04_seed40886.png,02/04/2026,2026-02-04,40886,B,handwriting_gan,pytorch_handwriting_gan
stress_runs\20260120_084954\images\2026\02\04_seed40887.png,02/04/2026,2026-02-04,40887,B,handwriting_gan,pytorch_handwriting_gan
stress_runs\20260120_084954\images\2026\02\05_seed40886.png,02/05/2026,2026-02-05,40886,B,handwriting_gan,pytorch_handwriting_gan
stress_runs\20260120_084954\images\2026\02\05_seed40887.png,02/05/2026,2026-02-05,40887,B,handwriting_gan,pytorch_handwriting_gan
stress_runs\20260120_084954\images\2026\02\05_seed40888.png,02/05/2026,2026-02-05,40888,B,handwriting_gan,pytorch_handwriting_gan
stress_runs\20260120_084954\images\2026\02\06_seed40887.png,02/06/2026,2026-02-06,40887,B,handwriting_gan,pytorch_handwriting_gan
stress_runs\20260120_084954\images\2026\02\06_seed40888.png,02/06/2026,2026-02-06,40888,B,handwriting_gan,pytorch_handwriting_gan
stress_runs\20260120_084954\images\2026\02\06_seed40889.png,02/06/2026,2026-02-06,40889,B,handwriting_gan,pytorch_handwriting_gan
stress_runs\20260120_084954\images\2026\02\07_seed40888.png,02/07/2026,2026-02-07,40888,B,handwriting_gan,pytorch_handwriting_gan
stress_runs\20260120_084954\images\2026\02\07_seed40889.png,02/07/2026,2026-02-07,40889,B,handwriting_gan,pytorch_handwriting_gan
stress_runs\20260120_084954\images\2026\02\07_seed40890.png,02/07/2026,2026-02-07,40890,B,handwriting_gan,pytorch_handwriting_gan
stress_runs\20260120_084954\images\2026\02\08_seed40889.png,02/08/2026,2026-02-08,40889,B,handwriting_gan,pytorch_handwriting_gan
stress_runs\20260120_084954\images\2026\02\08_seed40890.png,02/08/2026,2026-02-08,40890,B,handwriting_gan,pytorch_handwriting_gan
stress_runs\20260120_084954\images\2026\02\08_seed40891.png,02/08/2026,2026-02-08,40891,B,handwriting_gan,pytorch_handwriting_gan
stress_runs\20260120_084954\images\2026\02\09_seed40890.png,02/09/2026,2026-02-09,40890,B,handwriting_gan,pytorch_handwriting_gan
stress_runs\20260120_084954\images\2026\02\09_seed40891.png,02/09/2026,2026-02-09,40891,B,handwriting_gan,pytorch_handwriting_gan
stress_runs\20260120_084954\images\2026\02\09_seed40892.png,02/09/2026,2026-02-09,40892,B,handwriting_gan,pytorch_handwriting_gan
stress_runs\20260120_084954\images\2026\02\10_seed40891.png,02/10/2026,2026-02-10,40891,B,handwriting_gan,pytorch_handwriting_gan
stress_runs\20260120_084954\images\2026\02\10_seed40892.png,02/10/2026,2026-02-10,40892,B,handwriting_gan,pytorch_handwriting_gan
stress_runs\20260120_084954\images\2026\02\10_seed40893.png,02/10/2026,2026-02-10,40893,B,handwriting_gan,pytorch_handwriting_gan
stress_runs\20260120_084954\images\2026\02\11_seed40892.png,02/11/2026,2026-02-11,40892,B,handwriting_gan,pytorch_handwriting_gan
stress_runs\20260120_084954\images\2026\02\11_seed40893.png,02/11/2026,2026-02-11,40893,B,handwriting_gan,pytorch_handwriting_gan
stress_runs\20260120_084954\images\2026\02\11_seed40894.png,02/11/2026,2026-02-11,40894,B,handwriting_gan,pytorch_handwriting_gan
stress_runs\20260120_084954\images\2026\02\12_seed40893.png,02/12/2026,2026-02-12,40893,B,handwriting_gan,pytorch_handwriting_gan
stress_runs\20260120_084954\images\2026\02\12_seed40894.png,02/12/2026,2026-02-12,40894,B,handwriting_gan,pytorch_handwriting_gan
stress_runs\20260120_084954\images\2026\02\12_seed40895.png,02/12/2026,2026-02-12,40895,B,handwriting_gan,pytorch_handwriting_gan
stress_runs\20260120_084954\images\2026\02\13_seed40894.png,02/13/2026,2026-02-13,40894,B,handwriting_gan,pytorch_handwriting_gan
stress_runs\20260120_084954\images\2026\02\13_seed40895.png,02/13/2026,2026-02-13,40895,B,handwriting_gan,pytorch_handwriting_gan
stress_runs\20260120_084954\images\2026\02\13_seed40896.png,02/13/2026,2026-02-13,40896,B,handwriting_gan,pytorch_handwriting_gan
stress_runs\20260120_084954\images\2026\02\14_seed40895.png,02/14/2026,2026-02-14,40895,B,handwriting_gan,pytorch_handwriting_gan
stress_runs\20260120_084954\images\2026\02\14_seed40896.png,02/14/2026,2026-02-14,40896,B,handwriting_gan,pytorch_handwriting_gan
stress_runs\20260120_084954\images\2026\02\14_seed40897.png,02/14/2026,2026-02-14,40897,B,handwriting_gan,pytorch_handwriting_gan
stress_runs\20260120_084954\images\2026\02\15_seed40896.png,02/15/2026,2026-02-15,40896,B,handwriting_gan,pytorch_handwriting_gan
stress_runs\20260120_084954\images\2026\02\15_seed40897.png,02/15/2026,2026-02-15,40897,B,handwriting_gan,pytorch_handwriting_gan
stress_runs\20260120_084954\images\2026\02\15_seed40898.png,02/15/2026,2026-02-15,40898,B,handwriting_gan,pytorch_handwriting_gan
stress_runs\20260120_084954\images\2026\02\16_seed40897.png,02/16/2026,2026-02-16,40897,B,handwriting_gan,pytorch_handwriting_gan
stress_runs\20260120_084954\images\2026\02\16_seed40898.png,02/16/2026,2026-02-16,40898,B,handwriting_gan,pytorch_handwriting_gan
stress_runs\20260120_084954\images\2026\02\16_seed40899.png,02/16/2026,2026-02-16,40899,B,handwriting_gan,pytorch_handwriting_gan
stress_runs\20260120_084954\images\2026\02\17_seed40898.png,02/17/2026,2026-02-17,40898,B,handwriting_gan,pytorch_handwriting_gan
stress_runs\20260120_084954\images\2026\02\17_seed40899.png,02/17/2026,2026-02-17,40899,B,handwriting_gan,pytorch_handwriting_gan
stress_runs\20260120_084954\images\2026\02\17_seed40900.png,02/17/2026,2026-02-17,40900,B,handwriting_gan,pytorch_handwriting_gan
stress_runs\20260120_084954\images\2026\02\18_seed40899.png,02/18/2026,2026-02-18,40899,B,handwriting_gan,pytorch_handwriting_gan
stress_runs\20260120_084954\images\2026\02\18_seed40900.png,02/18/2026,2026-02-18,40900,B,handwriting_gan,pytorch_handwriting_gan
stress_runs\20260120_084954\images\2026\02\18_seed40901.png,02/18/2026,2026-02-18,40901,B,handwriting_gan,pytorch_handwriting_gan
stress_runs\20260120_084954\images\2026\02\19_seed40900.png,02/19/2026,2026-02-19,40900,B,handwriting_gan,pytorch_handwriting_gan
stress_runs\20260120_084954\images\2026\02\19_seed40901.png,02/19/2026,2026-02-19,40901,B,handwriting_gan,pytorch_handwriting_gan
stress_runs\20260120_084954\images\2026\02\19_seed40902.png,02/19/2026,2026-02-19,40902,B,handwriting_gan,pytorch_handwriting_gan
stress_runs\20260120_084954\images\2026\02\20_seed40901.png,02/20/2026,2026-02-20,40901,B,handwriting_gan,pytorch_handwriting_gan
stress_runs\20260120_084954\images\2026\02\20_seed40902.png,02/20/2026,2026-02-20,40902,B,handwriting_gan,pytorch_handwriting_gan
stress_runs\20260120_084954\images\2026\02\20_seed40903.png,02/20/2026,2026-02-20,40903,B,handwriting_gan,pytorch_handwriting_gan
stress_runs\20260120_084954\images\2026\02\21_seed40902.png,02/21/2026,2026-02-21,40902,B,handwriting_gan,pytorch_handwriting_gan
stress_runs\20260120_084954\images\2026\02\21_seed40903.png,02/21/2026,2026-02-21,40903,B,handwriting_gan,pytorch_handwriting_gan
stress_runs\20260120_084954\images\2026\02\21_seed40904.png,02/21/2026,2026-02-21,40904,B,handwriting_gan,pytorch_handwriting_gan
stress_runs\20260120_084954\images\2026\02\22_seed40903.png,02/22/2026,2026-02-22,40903,B,handwriting_gan,pytorch_handwriting_gan
stress_runs\20260120_084954\images\2026\02\22_seed40904.png,02/22/2026,2026-02-22,40904,B,handwriting_gan,pytorch_handwriting_gan
stress_runs\20260120_084954\images\2026\02\22_seed40905.png,02/22/2026,2026-02-22,40905,B,handwriting_gan,pytorch_handwriting_gan
stress_runs\20260120_084954\images\2026\02\23_seed40904.png,02/23/2026,2026-02-23,40904,B,handwriting_gan,pytorch_handwriting_gan
stress_runs\20260120_084954\images\2026\02\23_seed40905.png,02/23/2026,2026-02-23,40905,B,handwriting_gan,pytorch_handwriting_gan
stress_runs\20260120_084954\images\2026\02\23_seed40906.png,02/23/2026,2026-02-23,40906,B,handwriting_gan,pytorch_handwriting_gan
stress_runs\20260120_084954\images\2026\02\24_seed40905.png,02/24/2026,2026-02-24,40905,B,handwriting_gan,pytorch_handwriting_gan
stress_runs\20260120_084954\images\2026\02\24_seed40906.png,02/24/2026,2026-02-24,40906,B,handwriting_gan,pytorch_handwriting_gan
stress_runs\20260120_084954\images\2026\02\24_seed40907.png,02/24/2026,2026-02-24,40907,B,handwriting_gan,pytorch_handwriting_gan
stress_runs\20260120_084954\images\2026\02\25_seed40906.png,02/25/2026,2026-02-25,40906,B,handwriting_gan,pytorch_handwriting_gan
stress_runs\20260120_084954\images\2026\02\25_seed40907.png,02/25/2026,2026-02-25,40907,B,handwriting_gan,pytorch_handwriting_gan
stress_runs\20260120_084954\images\2026\02\25_seed40908.png,02/25/2026,2026-02-25,40908,B,handwriting_gan,pytorch_handwriting_gan
stress_runs\20260120_084954\images\2026\02\26_seed40907.png,02/26/2026,2026-02-26,40907,B,handwriting_gan,pytorch_handwriting_gan
stress_runs\20260120_084954\images\2026\02\26_seed40908.png,02/26/2026,2026-02-26,40908,B,handwriting_gan,pytorch_handwriting_gan
stress_runs\20260120_084954\images\2026\02\26_seed40909.png,02/26/2026,2026-02-26,40909,B,handwriting_gan,pytorch_handwriting_gan
stress_runs\20260120_084954\images\2026\02\27_seed40908.png,02/27/2026,2026-02-27,40908,B,handwriting_gan,pytorch_handwriting_gan
stress_runs\20260120_084954\images\2026\02\27_seed40909.png,02/27/2026,2026-02-27,40909,B,handwriting_gan,pytorch_handwriting_gan
stress_runs\20260120_084954\images\2026\02\27_seed40910.png,02/27/2026,2026-02-27,40910,B,handwriting_gan,pytorch_handwriting_gan
stress_runs\20260120_084954\images\2026\02\28_seed40909.png,02/28/2026,2026-02-28,40909,B,handwriting_gan,pytorch_handwriting_gan
stress_runs\20260120_084954\images\2026\02\28_seed40910.png,02/28/2026,2026-02-28,40910,B,handwriting_gan,pytorch_handwriting_gan
stress_runs\20260120_084954\images\2026\02\28_seed40911.png,02/28/2026,2026-02-28,40911,B,handwriting_gan,pytorch_handwriting_gan
stress_runs\20260120_084954\images\2026\03\01_seed40910.png,03/01/2026,2026-03-01,40910,B,handwriting_gan,pytorch_handwriting_gan
stress_runs\20260120_084954\images\2026\03\01_seed40911.png,03/01/2026,2026-03-01,40911,B,handwriting_gan,pytorch_handwriting_gan
stress_runs\20260120_084954\images\2026\03\01_seed40912.png,03/01/2026,2026-03-01,40912,B,handwriting_gan,pytorch_handwriting_gan
stress_runs\20260120_084954\images\2026\03\02_seed40911.png,03/02/2026,2026-03-02,40911,B,handwriting_gan,pytorch_handwriting_gan
stress_runs\20260120_084954\images\2026\03\02_seed40912.png,03/02/2026,2026-03-02,40912,B,handwriting_gan,pytorch_handwriting_gan
stress_runs\20260120_084954\images\2026\03\02_seed40913.png,03/02/2026,2026-03-02,40913,B,handwriting_gan,pytorch_handwriting_gan
stress_runs\20260120_084954\images\2026\03\03_seed40912.png,03/03/2026,2026-03-03,40912,B,handwriting_gan,pytorch_handwriting_gan
stress_runs\20260120_084954\images\2026\03\03_seed40913.png,03/03/2026,2026-03-03,40913,B,handwriting_gan,pytorch_handwriting_gan
stress_runs\20260120_084954\images\2026\03\03_seed40914.png,03/03/2026,2026-03-03,40914,B,handwriting_gan,pytorch_handwriting_gan
stress_runs\20260120_084954\images\2026\03\04_seed40913.png,03/04/2026,2026-03-04,40913,B,handwriting_gan,pytorch_handwriting_gan
stress_runs\20260120_084954\images\2026\03\04_seed40914.png,03/04/2026,2026-03-04,40914,B,handwriting_gan,pytorch_handwriting_gan
stress_runs\20260120_084954\images\2026\03\04_seed40915.png,03/04/2026,2026-03-04,40915,B,handwriting_gan,pytorch_handwriting_gan
stress_runs\20260120_084954\images\2026\03\05_seed40914.png,03/05/2026,2026-03-05,40914,B,handwriting_gan,pytorch_handwriting_gan
stress_runs\20260120_084954\images\2026\03\05_seed40915.png,03/05/2026,2026-03-05,40915,B,handwriting_gan,pytorch_handwriting_gan
stress_runs\20260120_084954\images\2026\03\05_seed40916.png,03/05/2026,2026-03-05,40916,B,handwriting_gan,pytorch_handwriting_gan
stress_runs\20260120_084954\images\2026\03\06_seed40915.png,03/06/2026,2026-03-06,40915,B,handwriting_gan,pytorch_handwriting_gan
stress_runs\20260120_084954\images\2026\03\06_seed40916.png,03/06/2026,2026-03-06,40916,B,handwriting_gan,pytorch_handwriting_gan
stress_runs\20260120_084954\images\2026\03\06_seed40917.png,03/06/2026,2026-03-06,40917,B,handwriting_gan,pytorch_handwriting_gan
stress_runs\20260120_084954\images\2026\03\07_seed40916.png,03/07/2026,2026-03-07,40916,B,handwriting_gan,pytorch_handwriting_gan
stress_runs\20260120_084954\images\2026\03\07_seed40917.png,03/07/2026,2026-03-07,40917,B,handwriting_gan,pytorch_handwriting_gan
stress_runs\20260120_084954\images\2026\03\07_seed40918.png,03/07/2026,2026-03-07,40918,B,handwriting_gan,pytorch_handwriting_gan
stress_runs\20260120_084954\images\2026\03\08_seed40917.png,03/08/2026,2026-03-08,40917,B,handwriting_gan,pytorch_handwriting_gan
stress_runs\20260120_084954\images\2026\03\08_seed40918.png,03/08/2026,2026-03-08,40918,B,handwriting_gan,pytorch_handwriting_gan
stress_runs\20260120_084954\images\2026\03\08_seed40919.png,03/08/2026,2026-03-08,40919,B,handwriting_gan,pytorch_handwriting_gan
stress_runs\20260120_084954\images\2026\03\09_seed40918.png,03/09/2026,2026-03-09,40918,B,handwriting_gan,pytorch_handwriting_gan
stress_runs\20260120_084954\images\2026\03\09_seed40919.png,03/09/2026,2026-03-09,40919,B,handwriting_gan,pytorch_handwriting_gan
stress_runs\20260120_084954\images\2026\03\09_seed40920.png,03/09/2026,2026-03-09,40920,B,handwriting_gan,pytorch_handwriting_gan
stress_runs\20260120_084954\images\2026\03\10_seed40919.png,03/10/2026,2026-03-10,40919,B,handwriting_gan,pytorch_handwriting_gan
stress_runs\20260120_084954\images\2026\03\10_seed40920.png,03/10/2026,2026-03-10,40920,B,handwriting_gan,pytorch_handwriting_gan
stress_runs\20260120_084954\images\2026\03\10_seed40921.png,03/10/2026,2026-03-10,40921,B,handwriting_gan,pytorch_handwriting_gan
stress_runs\20260120_084954\images\2026\03\11_seed40920.png,03/11/2026,2026-03-11,40920,B,handwriting_gan,pytorch_handwriting_gan
stress_runs\20260120_084954\images\2026\03\11_seed40921.png,03/11/2026,2026-03-11,40921,B,handwriting_gan,pytorch_handwriting_gan
stress_runs\20260120_084954\images\2026\03\11_seed40922.png,03/11/2026,2026-03-11,40922,B,handwriting_gan,pytorch_handwriting_gan
stress_runs\20260120_084954\images\2026\03\12_seed40921.png,03/12/2026,2026-03-12,40921,B,handwriting_gan,pytorch_handwriting_gan
stress_runs\20260120_084954\images\2026\03\12_seed40922.png,03/12/2026,2026-03-12,40922,B,handwriting_gan,pytorch_handwriting_gan
stress_runs\20260120_084954\images\2026\03\12_seed40923.png,03/12/2026,2026-03-12,40923,B,handwriting_gan,pytorch_handwriting_gan
stress_runs\20260120_084954\images\2026\03\13_seed40922.png,03/13/2026,2026-03-13,40922,B,handwriting_gan,pytorch_handwriting_gan
stress_runs\20260120_084954\images\2026\03\13_seed40923.png,03/13/2026,2026-03-13,40923,B,handwriting_gan,pytorch_handwriting_gan
stress_runs\20260120_084954\images\2026\03\13_seed40924.png,03/13/2026,2026-03-13,40924,B,handwriting_gan,pytorch_handwriting_gan
stress_runs\20260120_084954\images\2026\03\14_seed40923.png,03/14/2026,2026-03-14,40923,B,handwriting_gan,pytorch_handwriting_gan
stress_runs\20260120_084954\images\2026\03\14_seed40924.png,03/14/2026,2026-03-14,40924,B,handwriting_gan,pytorch_handwriting_gan
stress_runs\20260120_084954\images\2026\03\14_seed40925.png,03/14/2026,2026-03-14,40925,B,handwriting_gan,pytorch_handwriting_gan
stress_runs\20260120_084954\images\2026\03\15_seed40924.png,03/15/2026,2026-03-15,40924,B,handwriting_gan,pytorch_handwriting_gan
stress_runs\20260120_084954\images\2026\03\15_seed40925.png,03/15/2026,2026-03-15,40925,B,handwriting_gan,pytorch_handwriting_gan
stress_runs\20260120_084954\images\2026\03\15_seed40926.png,03/15/2026,2026-03-15,40926,B,handwriting_gan,pytorch_handwriting_gan
stress_runs\20260120_084954\images\2026\03\16_seed40925.png,03/16/2026,2026-03-16,40925,B,handwriting_gan,pytorch_handwriting_gan
stress_runs\20260120_084954\images\2026\03\16_seed40926.png,03/16/2026,2026-03-16,40926,B,handwriting_gan,pytorch_handwriting_gan
stress_runs\20260120_084954\images\2026\03\16_seed40927.png,03/16/2026,2026-03-16,40927,B,handwriting_gan,pytorch_handwriting_gan
stress_runs\20260120_084954\images\2026\03\17_seed40926.png,03/17/2026,2026-03-17,40926,B,handwriting_gan,pytorch_handwriting_gan
stress_runs\20260120_084954\images\2026\03\17_seed40927.png,03/17/2026,2026-03-17,40927,B,handwriting_gan,pytorch_handwriting_gan
stress_runs\20260120_084954\images\2026\03\17_seed40928.png,03/17/2026,2026-03-17,40928,B,handwriting_gan,pytorch_handwriting_gan
stress_runs\20260120_084954\images\2026\03\18_seed40927.png,03/18/2026,2026-03-18,40927,B,handwriting_gan,pytorch_handwriting_gan
stress_runs\20260120_084954\images\2026\03\18_seed40928.png,03/18/2026,2026-03-18,40928,B,handwriting_gan,pytorch_handwriting_gan
stress_runs\20260120_084954\images\2026\03\18_seed40929.png,03/18/2026,2026-03-18,40929,B,handwriting_gan,pytorch_handwriting_gan
stress_runs\20260120_084954\images\2026\03\19_seed40928.png,03/19/2026,2026-03-19,40928,B,handwriting_gan,pytorch_handwriting_gan
stress_runs\20260120_084954\images\2026\03\19_seed40929.png,03/19/2026,2026-03-19,40929,B,handwriting_gan,pytorch_handwriting_gan
stress_runs\20260120_084954\images\2026\03\19_seed40930.png,03/19/2026,2026-03-19,40930,B,handwriting_gan,pytorch_handwriting_gan
stress_runs\20260120_084954\images\2026\03\20_seed40929.png,03/20/2026,2026-03-20,40929,B,handwriting_gan,pytorch_handwriting_gan
stress_runs\20260120_084954\images\2026\03\20_seed40930.png,03/20/2026,2026-03-20,40930,B,handwriting_gan,pytorch_handwriting_gan
stress_runs\20260120_084954\images\2026\03\20_seed40931.png,03/20/2026,2026-03-20,40931,B,handwriting_gan,pytorch_handwriting_gan
stress_runs\20260120_084954\images\2026\03\21_seed40930.png,03/21/2026,2026-03-21,40930,B,handwriting_gan,pytorch_handwriting_gan
stress_runs\20260120_084954\images\2026\03\21_seed40931.png,03/21/2026,2026-03-21,40931,B,handwriting_gan,pytorch_handwriting_gan
stress_runs\20260120_084954\images\2026\03\21_seed40932.png,03/21/2026,2026-03-21,40932,B,handwriting_gan,pytorch_handwriting_gan
stress_runs\20260120_084954\images\2026\03\22_seed40931.png,03/22/2026,2026-03-22,40931,B,handwriting_gan,pytorch_handwriting_gan
stress_runs\20260120_084954\images\2026\03\22_seed40932.png,03/22/2026,2026-03-22,40932,B,handwriting_gan,pytorch_handwriting_gan
stress_runs\20260120_084954\images\2026\03\22_seed40933.png,03/22/2026,2026-03-22,40933,B,handwriting_gan,pytorch_handwriting_gan
stress_runs\20260120_084954\images\2026\03\23_seed40932.png,03/23/2026,2026-03-23,40932,B,handwriting_gan,pytorch_handwriting_gan
stress_runs\20260120_084954\images\2026\03\23_seed40933.png,03/23/2026,2026-03-23,40933,B,handwriting_gan,pytorch_handwriting_gan
stress_runs\20260120_084954\images\2026\03\23_seed40934.png,03/23/2026,2026-03-23,40934,B,handwriting_gan,pytorch_handwriting_gan
stress_runs\20260120_084954\images\2026\03\24_seed40933.png,03/24/2026,2026-03-24,40933,B,handwriting_gan,pytorch_handwriting_gan
stress_runs\20260120_084954\images\2026\03\24_seed40934.png,03/24/2026,2026-03-24,40934,B,handwriting_gan,pytorch_handwriting_gan
stress_runs\20260120_084954\images\2026\03\24_seed40935.png,03/24/2026,2026-03-24,40935,B,handwriting_gan,pytorch_handwriting_gan
stress_runs\20260120_084954\images\2026\03\25_seed40934.png,03/25/2026,2026-03-25,40934,B,handwriting_gan,pytorch_handwriting_gan
stress_runs\20260120_084954\images\2026\03\25_seed40935.png,03/25/2026,2026-03-25,40935,B,handwriting_gan,pytorch_handwriting_gan
stress_runs\20260120_084954\images\2026\03\25_seed40936.png,03/25/2026,2026-03-25,40936,B,handwriting_gan,pytorch_handwriting_gan
stress_runs\20260120_084954\images\2026\03\26_seed40935.png,03/26/2026,2026-03-26,40935,B,handwriting_gan,pytorch_handwriting_gan
stress_runs\20260120_084954\images\2026\03\26_seed40936.png,03/26/2026,2026-03-26,40936,B,handwriting_gan,pytorch_handwriting_gan
stress_runs\20260120_084954\images\2026\03\26_seed40937.png,03/26/2026,2026-03-26,40937,B,handwriting_gan,pytorch_handwriting_gan
stress_runs\20260120_084954\images\2026\03\27_seed40936.png,03/27/2026,2026-03-27,40936,B,handwriting_gan,pytorch_handwriting_gan
stress_runs\20260120_084954\images\2026\03\27_seed40937.png,03/27/2026,2026-03-27,40937,B,handwriting_gan,pytorch_handwriting_gan
stress_runs\20260120_084954\images\2026\03\27_seed40938.png,03/27/2026,2026-03-27,40938,B,handwriting_gan,pytorch_handwriting_gan
stress_runs\20260120_084954\images\2026\03\28_seed40937.png,03/28/2026,2026-03-28,40937,B,handwriting_gan,pytorch_handwriting_gan
stress_runs\20260120_084954\images\2026\03\28_seed40938.png,03/28/2026,2026-03-28,40938,B,handwriting_gan,pytorch_handwriting_gan
stress_runs\20260120_084954\images\2026\03\28_seed40939.png,03/28/2026,2026-03-28,40939,B,handwriting_gan,pytorch_handwriting_gan
stress_runs\20260120_084954\images\2026\03\29_seed40938.png,03/29/2026,2026-03-29,40938,B,handwriting_gan,pytorch_handwriting_gan
stress_runs\20260120_084954\images\2026\03\29_seed40939.png,03/29/2026,2026-03-29,40939,B,handwriting_gan,pytorch_handwriting_gan
stress_runs\20260120_084954\images\2026\03\29_seed40940.png,03/29/2026,2026-03-29,40940,B,handwriting_gan,pytorch_handwriting_gan
stress_runs\20260120_084954\images\2026\03\30_seed40939.png,03/30/2026,2026-03-30,40939,B,handwriting_gan,pytorch_handwriting_gan
stress_runs\20260120_084954\images\2026\03\30_seed40940.png,03/30/2026,2026-03-30,40940,B,handwriting_gan,pytorch_handwriting_gan
stress_runs\20260120_084954\images\2026\03\30_seed40941.png,03/30/2026,2026-03-30,40941,B,handwriting_gan,pytorch_handwriting_gan
stress_runs\20260120_084954\images\2026\03\31_seed40940.png,03/31/2026,2026-03-31,40940,B,handwriting_gan,pytorch_handwriting_gan
stress_runs\20260120_084954\images\2026\03\31_seed40941.png,03/31/2026,2026-03-31,40941,B,handwriting_gan,pytorch_handwriting_gan
stress_runs\20260120_084954\images\2026\03\31_seed40942.png,03/31/2026,2026-03-31,40942,B,handwriting_gan,pytorch_handwriting_gan
stress_runs\20260120_084954\images\2026\04\01_seed40941.png,04/01/2026,2026-04-01,40941,B,handwriting_gan,pytorch_handwriting_gan
stress_runs\20260120_084954\images\2026\04\01_seed40942.png,04/01/2026,2026-04-01,40942,B,handwriting_gan,pytorch_handwriting_gan
stress_runs\20260120_084954\images\2026\04\01_seed40943.png,04/01/2026,2026-04-01,40943,B,handwriting_gan,pytorch_handwriting_gan
stress_runs\20260120_084954\images\2026\04\02_seed40942.png,04/02/2026,2026-04-02,40942,B,handwriting_gan,pytorch_handwriting_gan
stress_runs\20260120_084954\images\2026\04\02_seed40943.png,04/02/2026,2026-04-02,40943,B,handwriting_gan,pytorch_handwriting_gan
stress_runs\20260120_084954\images\2026\04\02_seed40944.png,04/02/2026,2026-04-02,40944,B,handwriting_gan,pytorch_handwriting_gan
stress_runs\20260120_084954\images\2026\04\03_seed40943.png,04/03/2026,2026-04-03,40943,B,handwriting_gan,pytorch_handwriting_gan
stress_runs\20260120_084954\images\2026\04\03_seed40944.png,04/03/2026,2026-04-03,40944,B,handwriting_gan,pytorch_handwriting_gan
stress_runs\20260120_084954\images\2026\04\03_seed40945.png,04/03/2026,2026-04-03,40945,B,handwriting_gan,pytorch_handwriting_gan
stress_runs\20260120_084954\images\2026\04\04_seed40944.png,04/04/2026,2026-04-04,40944,B,handwriting_gan,pytorch_handwriting_gan
stress_runs\20260120_084954\images\2026\04\04_seed40945.png,04/04/2026,2026-04-04,40945,B,handwriting_gan,pytorch_handwriting_gan
stress_runs\20260120_084954\images\2026\04\04_seed40946.png,04/04/2026,2026-04-04,40946,B,handwriting_gan,pytorch_handwriting_gan
stress_runs\20260120_084954\images\2026\04\05_seed40945.png,04/05/2026,2026-04-05,40945,B,handwriting_gan,pytorch_handwriting_gan
stress_runs\20260120_084954\images\2026\04\05_seed40946.png,04/05/2026,2026-04-05,40946,B,handwriting_gan,pytorch_handwriting_gan
stress_runs\20260120_084954\images\2026\04\05_seed40947.png,04/05/2026,2026-04-05,40947,B,handwriting_gan,pytorch_handwriting_gan
stress_runs\20260120_084954\images\2026\04\06_seed40946.png,04/06/2026,2026-04-06,40946,B,handwriting_gan,pytorch_handwriting_gan
stress_runs\20260120_084954\images\2026\04\06_seed40947.png,04/06/2026,2026-04-06,40947,B,handwriting_gan,pytorch_handwriting_gan
stress_runs\20260120_084954\images\2026\04\06_seed40948.png,04/06/2026,2026-04-06,40948,B,handwriting_gan,pytorch_handwriting_gan
stress_runs\20260120_084954\images\2026\04\07_seed40947.png,04/07/2026,2026-04-07,40947,B,handwriting_gan,pytorch_handwriting_gan
stress_runs\20260120_084954\images\2026\04\07_seed40948.png,04/07/2026,2026-04-07,40948,B,handwriting_gan,pytorch_handwriting_gan
stress_runs\20260120_084954\images\2026\04\07_seed40949.png,04/07/2026,2026-04-07,40949,B,handwriting_gan,pytorch_handwriting_gan
stress_runs\20260120_084954\images\2026\04\08_seed40948.png,04/08/2026,2026-04-08,40948,B,handwriting_gan,pytorch_handwriting_gan
stress_runs\20260120_084954\images\2026\04\08_seed40949.png,04/08/2026,2026-04-08,40949,B,handwriting_gan,pytorch_handwriting_gan
stress_runs\20260120_084954\images\2026\04\08_seed40950.png,04/08/2026,2026-04-08,40950,B,handwriting_gan,pytorch_handwriting_gan
stress_runs\20260120_084954\images\2026\04\09_seed40949.png,04/09/2026,2026-04-09,40949,B,handwriting_gan,pytorch_handwriting_gan
stress_runs\20260120_084954\images\2026\04\09_seed40950.png,04/09/2026,2026-04-09,40950,B,handwriting_gan,pytorch_handwriting_gan
stress_runs\20260120_084954\images\2026\04\09_seed40951.png,04/09/2026,2026-04-09,40951,B,handwriting_gan,pytorch_handwriting_gan
stress_runs\20260120_084954\images\2026\04\10_seed40950.png,04/10/2026,2026-04-10,40950,B,handwriting_gan,pytorch_handwriting_gan
stress_runs\20260120_084954\images\2026\04\10_seed40951.png,04/10/2026,2026-04-10,40951,B,handwriting_gan,pytorch_handwriting_gan
stress_runs\20260120_084954\images\2026\04\10_seed40952.png,04/10/2026,2026-04-10,40952,B,handwriting_gan,pytorch_handwriting_gan
stress_runs\20260120_084954\images\2026\04\11_seed40951.png,04/11/2026,2026-04-11,40951,B,handwriting_gan,pytorch_handwriting_gan
stress_runs\20260120_084954\images\2026\04\11_seed40952.png,04/11/2026,2026-04-11,40952,B,handwriting_gan,pytorch_handwriting_gan
stress_runs\20260120_084954\images\2026\04\11_seed40953.png,04/11/2026,2026-04-11,40953,B,handwriting_gan,pytorch_handwriting_gan
stress_runs\20260120_084954\images\2026\04\12_seed40952.png,04/12/2026,2026-04-12,40952,B,handwriting_gan,pytorch_handwriting_gan
stress_runs\20260120_084954\images\2026\04\12_seed40953.png,04/12/2026,2026-04-12,40953,B,handwriting_gan,pytorch_handwriting_gan
stress_runs\20260120_084954\images\2026\04\12_seed40954.png,04/12/2026,2026-04-12,40954,B,handwriting_gan,pytorch_handwriting_gan
stress_runs\20260120_084954\images\2026\04\13_seed40953.png,04/13/2026,2026-04-13,40953,B,handwriting_gan,pytorch_handwriting_gan
stress_runs\20260120_084954\images\2026\04\13_seed40954.png,04/13/2026,2026-04-13,40954,B,handwriting_gan,pytorch_handwriting_gan
stress_runs\20260120_084954\images\2026\04\13_seed40955.png,04/13/2026,2026-04-13,40955,B,handwriting_gan,pytorch_handwriting_gan
stress_runs\20260120_084954\images\2026\04\14_seed40954.png,04/14/2026,2026-04-14,40954,B,handwriting_gan,pytorch_handwriting_gan
stress_runs\20260120_084954\images\2026\04\14_seed40955.png,04/14/2026,2026-04-14,40955,B,handwriting_gan,pytorch_handwriting_gan
stress_runs\20260120_084954\images\2026\04\14_seed40956.png,04/14/2026,2026-04-14,40956,B,handwriting_gan,pytorch_handwriting_gan
stress_runs\20260120_084954\images\2026\04\15_seed40955.png,04/15/2026,2026-04-15,40955,B,handwriting_gan,pytorch_handwriting_gan
stress_runs\20260120_084954\images\2026\04\15_seed40956.png,04/15/2026,2026-04-15,40956,B,handwriting_gan,pytorch_handwriting_gan
stress_runs\20260120_084954\images\2026\04\15_seed40957.png,04/15/2026,2026-04-15,40957,B,handwriting_gan,pytorch_handwriting_gan
stress_runs\20260120_084954\images\2026\04\16_seed40956.png,04/16/2026,2026-04-16,40956,B,handwriting_gan,pytorch_handwriting_gan
stress_runs\20260120_084954\images\2026\04\16_seed40957.png,04/16/2026,2026-04-16,40957,B,handwriting_gan,pytorch_handwriting_gan
stress_runs\20260120_084954\images\2026\04\16_seed40958.png,04/16/2026,2026-04-16,40958,B,handwriting_gan,pytorch_handwriting_gan
stress_runs\20260120_084954\images\2026\04\17_seed40957.png,04/17/2026,2026-04-17,40957,B,handwriting_gan,pytorch_handwriting_gan
stress_runs\20260120_084954\images\2026\04\17_seed40958.png,04/17/2026,2026-04-17,40958,B,handwriting_gan,pytorch_handwriting_gan
stress_runs\20260120_084954\images\2026\04\17_seed40959.png,04/17/2026,2026-04-17,40959,B,handwriting_gan,pytorch_handwriting_gan
stress_runs\20260120_084954\images\2026\04\18_seed40958.png,04/18/2026,2026-04-18,40958,B,handwriting_gan,pytorch_handwriting_gan
stress_runs\20260120_084954\images\2026\04\18_seed40959.png,04/18/2026,2026-04-18,40959,B,handwriting_gan,pytorch_handwriting_gan
stress_runs\20260120_084954\images\2026\04\18_seed40960.png,04/18/2026,2026-04-18,40960,B,handwriting_gan,pytorch_handwriting_gan
stress_runs\20260120_084954\images\2026\04\19_seed40959.png,04/19/2026,2026-04-19,40959,B,handwriting_gan,pytorch_handwriting_gan
stress_runs\20260120_084954\images\2026\04\19_seed40960.png,04/19/2026,2026-04-19,40960,B,handwriting_gan,pytorch_handwriting_gan
stress_runs\20260120_084954\images\2026\04\19_seed40961.png,04/19/2026,2026-04-19,40961,B,handwriting_gan,pytorch_handwriting_gan
stress_runs\20260120_084954\images\2026\04\20_seed40960.png,04/20/2026,2026-04-20,40960,B,handwriting_gan,pytorch_handwriting_gan
stress_runs\20260120_084954\images\2026\04\20_seed40961.png,04/20/2026,2026-04-20,40961,B,handwriting_gan,pytorch_handwriting_gan
stress_runs\20260120_084954\images\2026\04\20_seed40962.png,04/20/2026,2026-04-20,40962,B,handwriting_gan,pytorch_handwriting_gan
stress_runs\20260120_084954\images\2026\04\21_seed40961.png,04/21/2026,2026-04-21,40961,B,handwriting_gan,pytorch_handwriting_gan
stress_runs\20260120_084954\images\2026\04\21_seed40962.png,04/21/2026,2026-04-21,40962,B,handwriting_gan,pytorch_handwriting_gan
stress_runs\20260120_084954\images\2026\04\21_seed40963.png,04/21/2026,2026-04-21,40963,B,handwriting_gan,pytorch_handwriting_gan
stress_runs\20260120_084954\images\2026\04\22_seed40962.png,04/22/2026,2026-04-22,40962,B,handwriting_gan,pytorch_handwriting_gan
stress_runs\20260120_084954\images\2026\04\22_seed40963.png,04/22/2026,2026-04-22,40963,B,handwriting_gan,pytorch_handwriting_gan
stress_runs\20260120_084954\images\2026\04\22_seed40964.png,04/22/2026,2026-04-22,40964,B,handwriting_gan,pytorch_handwriting_gan
stress_runs\20260120_084954\images\2026\04\23_seed40963.png,04/23/2026,2026-04-23,40963,B,handwriting_gan,pytorch_handwriting_gan
stress_runs\20260120_084954\images\2026\04\23_seed40964.png,04/23/2026,2026-04-23,40964,B,handwriting_gan,pytorch_handwriting_gan
stress_runs\20260120_084954\images\2026\04\23_seed40965.png,04/23/2026,2026-04-23,40965,B,handwriting_gan,pytorch_handwriting_gan
stress_runs\20260120_084954\images\2026\04\24_seed40964.png,04/24/2026,2026-04-24,40964,B,handwriting_gan,pytorch_handwriting_gan
stress_runs\20260120_084954\images\2026\04\24_seed40965.png,04/24/2026,2026-04-24,40965,B,handwriting_gan,pytorch_handwriting_gan
stress_runs\20260120_084954\images\2026\04\24_seed40966.png,04/24/2026,2026-04-24,40966,B,handwriting_gan,pytorch_handwriting_gan
stress_runs\20260120_084954\images\2026\04\25_seed40965.png,04/25/2026,2026-04-25,40965,B,handwriting_gan,pytorch_handwriting_gan
stress_runs\20260120_084954\images\2026\04\25_seed40966.png,04/25/2026,2026-04-25,40966,B,handwriting_gan,pytorch_handwriting_gan
stress_runs\20260120_084954\images\2026\04\25_seed40967.png,04/25/2026,2026-04-25,40967,B,handwriting_gan,pytorch_handwriting_gan
stress_runs\20260120_084954\images\2026\04\26_seed40966.png,04/26/2026,2026-04-26,40966,B,handwriting_gan,pytorch_handwriting_gan
stress_runs\20260120_084954\images\2026\04\26_seed40967.png,04/26/2026,2026-04-26,40967,B,handwriting_gan,pytorch_handwriting_gan
stress_runs\20260120_084954\images\2026\04\26_seed40968.png,04/26/2026,2026-04-26,40968,B,handwriting_gan,pytorch_handwriting_gan
stress_runs\20260120_084954\images\2026\04\27_seed40967.png,04/27/2026,2026-04-27,40967,B,handwriting_gan,pytorch_handwriting_gan
stress_runs\20260120_084954\images\2026\04\27_seed40968.png,04/27/2026,2026-04-27,40968,B,handwriting_gan,pytorch_handwriting_gan
stress_runs\20260120_084954\images\2026\04\27_seed40969.png,04/27/2026,2026-04-27,40969,B,handwriting_gan,pytorch_handwriting_gan
stress_runs\20260120_084954\images\2026\04\28_seed40968.png,04/28/2026,2026-04-28,40968,B,handwriting_gan,pytorch_handwriting_gan
stress_runs\20260120_084954\images\2026\04\28_seed40969.png,04/28/2026,2026-04-28,40969,B,handwriting_gan,pytorch_handwriting_gan
stress_runs\20260120_084954\images\2026\04\28_seed40970.png,04/28/2026,2026-04-28,40970,B,handwriting_gan,pytorch_handwriting_gan
stress_runs\20260120_084954\images\2026\04\29_seed40969.png,04/29/2026,2026-04-29,40969,B,handwriting_gan,pytorch_handwriting_gan
stress_runs\20260120_084954\images\2026\04\29_seed40970.png,04/29/2026,2026-04-29,40970,B,handwriting_gan,pytorch_handwriting_gan
stress_runs\20260120_084954\images\2026\04\29_seed40971.png,04/29/2026,2026-04-29,40971,B,handwriting_gan,pytorch_handwriting_gan
stress_runs\20260120_084954\images\2026\04\30_seed40970.png,04/30/2026,2026-04-30,40970,B,handwriting_gan,pytorch_handwriting_gan
stress_runs\20260120_084954\images\2026\04\30_seed40971.png,04/30/2026,2026-04-30,40971,B,handwriting_gan,pytorch_handwriting_gan
stress_runs\20260120_084954\images\2026\04\30_seed40972.png,04/30/2026,2026-04-30,40972,B,handwriting_gan,pytorch_handwriting_gan
stress_runs\20260120_084954\images\2026\05\01_seed40971.png,05/01/2026,2026-05-01,40971,B,handwriting_gan,pytorch_handwriting_gan
stress_runs\20260120_084954\images\2026\05\01_seed40972.png,05/01/2026,2026-05-01,40972,B,handwriting_gan,pytorch_handwriting_gan
stress_runs\20260120_084954\images\2026\05\01_seed40973.png,05/01/2026,2026-05-01,40973,B,handwriting_gan,pytorch_handwriting_gan
stress_runs\20260120_084954\images\2026\05\02_seed40972.png,05/02/2026,2026-05-02,40972,B,handwriting_gan,pytorch_handwriting_gan
stress_runs\20260120_084954\images\2026\05\02_seed40973.png,05/02/2026,2026-05-02,40973,B,handwriting_gan,pytorch_handwriting_gan
stress_runs\20260120_084954\images\2026\05\02_seed40974.png,05/02/2026,2026-05-02,40974,B,handwriting_gan,pytorch_handwriting_gan
stress_runs\20260120_084954\images\2026\05\03_seed40973.png,05/03/2026,2026-05-03,40973,B,handwriting_gan,pytorch_handwriting_gan
stress_runs\20260120_084954\images\2026\05\03_seed40974.png,05/03/2026,2026-05-03,40974,B,handwriting_gan,pytorch_handwriting_gan
stress_runs\20260120_084954\images\2026\05\03_seed40975.png,05/03/2026,2026-05-03,40975,B,handwriting_gan,pytorch_handwriting_gan
stress_runs\20260120_084954\images\2026\05\04_seed40974.png,05/04/2026,2026-05-04,40974,B,handwriting_gan,pytorch_handwriting_gan
stress_runs\20260120_084954\images\2026\05\04_seed40975.png,05/04/2026,2026-05-04,40975,B,handwriting_gan,pytorch_handwriting_gan
stress_runs\20260120_084954\images\2026\05\04_seed40976.png,05/04/2026,2026-05-04,40976,B,handwriting_gan,pytorch_handwriting_gan
stress_runs\20260120_084954\images\2026\05\05_seed40975.png,05/05/2026,2026-05-05,40975,B,handwriting_gan,pytorch_handwriting_gan
stress_runs\20260120_084954\images\2026\05\05_seed40976.png,05/05/2026,2026-05-05,40976,B,handwriting_gan,pytorch_handwriting_gan
stress_runs\20260120_084954\images\2026\05\05_seed40977.png,05/05/2026,2026-05-05,40977,B,handwriting_gan,pytorch_handwriting_gan
stress_runs\20260120_084954\images\2026\05\06_seed40976.png,05/06/2026,2026-05-06,40976,B,handwriting_gan,pytorch_handwriting_gan
stress_runs\20260120_084954\images\2026\05\06_seed40977.png,05/06/2026,2026-05-06,40977,B,handwriting_gan,pytorch_handwriting_gan
stress_runs\20260120_084954\images\2026\05\06_seed40978.png,05/06/2026,2026-05-06,40978,B,handwriting_gan,pytorch_handwriting_gan
stress_runs\20260120_084954\images\2026\05\07_seed40977.png,05/07/2026,2026-05-07,40977,B,handwriting_gan,pytorch_handwriting_gan
stress_runs\20260120_084954\images\2026\05\07_seed40978.png,05/07/2026,2026-05-07,40978,B,handwriting_gan,pytorch_handwriting_gan
stress_runs\20260120_084954\images\2026\05\07_seed40979.png,05/07/2026,2026-05-07,40979,B,handwriting_gan,pytorch_handwriting_gan
stress_runs\20260120_084954\images\2026\05\08_seed40978.png,05/08/2026,2026-05-08,40978,B,handwriting_gan,pytorch_handwriting_gan
stress_runs\20260120_084954\images\2026\05\08_seed40979.png,05/08/2026,2026-05-08,40979,B,handwriting_gan,pytorch_handwriting_gan
stress_runs\20260120_084954\images\2026\05\08_seed40980.png,05/08/2026,2026-05-08,40980,B,handwriting_gan,pytorch_handwriting_gan
stress_runs\20260120_084954\images\2026\05\09_seed40979.png,05/09/2026,2026-05-09,40979,B,handwriting_gan,pytorch_handwriting_gan
stress_runs\20260120_084954\images\2026\05\09_seed40980.png,05/09/2026,2026-05-09,40980,B,handwriting_gan,pytorch_handwriting_gan
stress_runs\20260120_084954\images\2026\05\09_seed40981.png,05/09/2026,2026-05-09,40981,B,handwriting_gan,pytorch_handwriting_gan
stress_runs\20260120_084954\images\2026\05\10_seed40980.png,05/10/2026,2026-05-10,40980,B,handwriting_gan,pytorch_handwriting_gan
stress_runs\20260120_084954\images\2026\05\10_seed40981.png,05/10/2026,2026-05-10,40981,B,handwriting_gan,pytorch_handwriting_gan
stress_runs\20260120_084954\images\2026\05\10_seed40982.png,05/10/2026,2026-05-10,40982,B,handwriting_gan,pytorch_handwriting_gan
stress_runs\20260120_084954\images\2026\05\11_seed40981.png,05/11/2026,2026-05-11,40981,B,handwriting_gan,pytorch_handwriting_gan
stress_runs\20260120_084954\images\2026\05\11_seed40982.png,05/11/2026,2026-05-11,40982,B,handwriting_gan,pytorch_handwriting_gan
stress_runs\20260120_084954\images\2026\05\11_seed40983.png,05/11/2026,2026-05-11,40983,B,handwriting_gan,pytorch_handwriting_gan
stress_runs\20260120_084954\images\2026\05\12_seed40982.png,05/12/2026,2026-05-12,40982,B,handwriting_gan,pytorch_handwriting_gan
stress_runs\20260120_084954\images\2026\05\12_seed40983.png,05/12/2026,2026-05-12,40983,B,handwriting_gan,pytorch_handwriting_gan
stress_runs\20260120_084954\images\2026\05\12_seed40984.png,05/12/2026,2026-05-12,40984,B,handwriting_gan,pytorch_handwriting_gan
stress_runs\20260120_084954\images\2026\05\13_seed40983.png,05/13/2026,2026-05-13,40983,B,handwriting_gan,pytorch_handwriting_gan
stress_runs\20260120_084954\images\2026\05\13_seed40984.png,05/13/2026,2026-05-13,40984,B,handwriting_gan,pytorch_handwriting_gan
stress_runs\20260120_084954\images\2026\05\13_seed40985.png,05/13/2026,2026-05-13,40985,B,handwriting_gan,pytorch_handwriting_gan
stress_runs\20260120_084954\images\2026\05\14_seed40984.png,05/14/2026,2026-05-14,40984,B,handwriting_gan,pytorch_handwriting_gan
stress_runs\20260120_084954\images\2026\05\14_seed40985.png,05/14/2026,2026-05-14,40985,B,handwriting_gan,pytorch_handwriting_gan
stress_runs\20260120_084954\images\2026\05\14_seed40986.png,05/14/2026,2026-05-14,40986,B,handwriting_gan,pytorch_handwriting_gan
stress_runs\20260120_084954\images\2026\05\15_seed40985.png,05/15/2026,2026-05-15,40985,B,handwriting_gan,pytorch_handwriting_gan
stress_runs\20260120_084954\images\2026\05\15_seed40986.png,05/15/2026,2026-05-15,40986,B,handwriting_gan,pytorch_handwriting_gan
stress_runs\20260120_084954\images\2026\05\15_seed40987.png,05/15/2026,2026-05-15,40987,B,handwriting_gan,pytorch_handwriting_gan
stress_runs\20260120_084954\images\2026\05\16_seed40986.png,05/16/2026,2026-05-16,40986,B,handwriting_gan,pytorch_handwriting_gan
stress_runs\20260120_084954\images\2026\05\16_seed40987.png,05/16/2026,2026-05-16,40987,B,handwriting_gan,pytorch_handwriting_gan
stress_runs\20260120_084954\images\2026\05\16_seed40988.png,05/16/2026,2026-05-16,40988,B,handwriting_gan,pytorch_handwriting_gan
stress_runs\20260120_084954\images\2026\05\17_seed40987.png,05/17/2026,2026-05-17,40987,B,handwriting_gan,pytorch_handwriting_gan
stress_runs\20260120_084954\images\2026\05\17_seed40988.png,05/17/2026,2026-05-17,40988,B,handwriting_gan,pytorch_handwriting_gan
stress_runs\20260120_084954\images\2026\05\17_seed40989.png,05/17/2026,2026-05-17,40989,B,handwriting_gan,pytorch_handwriting_gan
stress_runs\20260120_084954\images\2026\05\18_seed40988.png,05/18/2026,2026-05-18,40988,B,handwriting_gan,pytorch_handwriting_gan
stress_runs\20260120_084954\images\2026\05\18_seed40989.png,05/18/2026,2026-05-18,40989,B,handwriting_gan,pytorch_handwriting_gan
stress_runs\20260120_084954\images\2026\05\18_seed40990.png,05/18/2026,2026-05-18,40990,B,handwriting_gan,pytorch_handwriting_gan
stress_runs\20260120_084954\images\2026\05\19_seed40989.png,05/19/2026,2026-05-19,40989,B,handwriting_gan,pytorch_handwriting_gan
stress_runs\20260120_084954\images\2026\05\19_seed40990.png,05/19/2026,2026-05-19,40990,B,handwriting_gan,pytorch_handwriting_gan
stress_runs\20260120_084954\images\2026\05\19_seed40991.png,05/19/2026,2026-05-19,40991,B,handwriting_gan,pytorch_handwriting_gan
stress_runs\20260120_084954\images\2026\05\20_seed40990.png,05/20/2026,2026-05-20,40990,B,handwriting_gan,pytorch_handwriting_gan
stress_runs\20260120_084954\images\2026\05\20_seed40991.png,05/20/2026,2026-05-20,40991,B,handwriting_gan,pytorch_handwriting_gan
stress_runs\20260120_084954\images\2026\05\20_seed40992.png,05/20/2026,2026-05-20,40992,B,handwriting_gan,pytorch_handwriting_gan
stress_runs\20260120_084954\images\2026\05\21_seed40991.png,05/21/2026,2026-05-21,40991,B,handwriting_gan,pytorch_handwriting_gan
stress_runs\20260120_084954\images\2026\05\21_seed40992.png,05/21/2026,2026-05-21,40992,B,handwriting_gan,pytorch_handwriting_gan
stress_runs\20260120_084954\images\2026\05\21_seed40993.png,05/21/2026,2026-05-21,40993,B,handwriting_gan,pytorch_handwriting_gan
stress_runs\20260120_084954\images\2026\05\22_seed40992.png,05/22/2026,2026-05-22,40992,B,handwriting_gan,pytorch_handwriting_gan
stress_runs\20260120_084954\images\2026\05\22_seed40993.png,05/22/2026,2026-05-22,40993,B,handwriting_gan,pytorch_handwriting_gan
stress_runs\20260120_084954\images\2026\05\22_seed40994.png,05/22/2026,2026-05-22,40994,B,handwriting_gan,pytorch_handwriting_gan
stress_runs\20260120_084954\images\2026\05\23_seed40993.png,05/23/2026,2026-05-23,40993,B,handwriting_gan,pytorch_handwriting_gan
stress_runs\20260120_084954\images\2026\05\23_seed40994.png,05/23/2026,2026-05-23,40994,B,handwriting_gan,pytorch_handwriting_gan
stress_runs\20260120_084954\images\2026\05\23_seed40995.png,05/23/2026,2026-05-23,40995,B,handwriting_gan,pytorch_handwriting_gan
stress_runs\20260120_084954\images\2026\05\24_seed40994.png,05/24/2026,2026-05-24,40994,B,handwriting_gan,pytorch_handwriting_gan
stress_runs\20260120_084954\images\2026\05\24_seed40995.png,05/24/2026,2026-05-24,40995,B,handwriting_gan,pytorch_handwriting_gan
stress_runs\20260120_084954\images\2026\05\24_seed40996.png,05/24/2026,2026-05-24,40996,B,handwriting_gan,pytorch_handwriting_gan
stress_runs\20260120_084954\images\2026\05\25_seed40995.png,05/25/2026,2026-05-25,40995,B,handwriting_gan,pytorch_handwriting_gan
stress_runs\20260120_084954\images\2026\05\25_seed40996.png,05/25/2026,2026-05-25,40996,B,handwriting_gan,pytorch_handwriting_gan
stress_runs\20260120_084954\images\2026\05\25_seed40997.png,05/25/2026,2026-05-25,40997,B,handwriting_gan,pytorch_handwriting_gan
stress_runs\20260120_084954\images\2026\05\26_seed40996.png,05/26/2026,2026-05-26,40996,B,handwriting_gan,pytorch_handwriting_gan
stress_runs\20260120_084954\images\2026\05\26_seed40997.png,05/26/2026,2026-05-26,40997,B,handwriting_gan,pytorch_handwriting_gan
stress_runs\20260120_084954\images\2026\05\26_seed40998.png,05/26/2026,2026-05-26,40998,B,handwriting_gan,pytorch_handwriting_gan
stress_runs\20260120_084954\images\2026\05\27_seed40997.png,05/27/2026,2026-05-27,40997,B,handwriting_gan,pytorch_handwriting_gan
stress_runs\20260120_084954\images\2026\05\27_seed40998.png,05/27/2026,2026-05-27,40998,B,handwriting_gan,pytorch_handwriting_gan
stress_runs\20260120_084954\images\2026\05\27_seed40999.png,05/27/2026,2026-05-27,40999,B,handwriting_gan,pytorch_handwriting_gan
stress_runs\20260120_084954\images\2026\05\28_seed40998.png,05/28/2026,2026-05-28,40998,B,handwriting_gan,pytorch_handwriting_gan
stress_runs\20260120_084954\images\2026\05\28_seed40999.png,05/28/2026,2026-05-28,40999,B,handwriting_gan,pytorch_handwriting_gan
stress_runs\20260120_084954\images\2026\05\28_seed41000.png,05/28/2026,2026-05-28,41000,B,handwriting_gan,pytorch_handwriting_gan
stress_runs\20260120_084954\images\2026\05\29_seed40999.png,05/29/2026,2026-05-29,40999,B,handwriting_gan,pytorch_handwriting_gan
stress_runs\20260120_084954\images\2026\05\29_seed41000.png,05/29/2026,2026-05-29,41000,B,handwriting_gan,pytorch_handwriting_gan
stress_runs\20260120_084954\images\2026\05\29_seed41001.png,05/29/2026,2026-05-29,41001,B,handwriting_gan,pytorch_handwriting_gan
stress_runs\20260120_084954\images\2026\05\30_seed41000.png,05/30/2026,2026-05-30,41000,B,handwriting_gan,pytorch_handwriting_gan
stress_runs\20260120_084954\images\2026\05\30_seed41001.png,05/30/2026,2026-05-30,41001,B,handwriting_gan,pytorch_handwriting_gan
stress_runs\20260120_084954\images\2026\05\30_seed41002.png,05/30/2026,2026-05-30,41002,B,handwriting_gan,pytorch_handwriting_gan
stress_runs\20260120_084954\images\2026\05\31_seed41001.png,05/31/2026,2026-05-31,41001,B,handwriting_gan,pytorch_handwriting_gan
stress_runs\20260120_084954\images\2026\05\31_seed41002.png,05/31/2026,2026-05-31,41002,B,handwriting_gan,pytorch_handwriting_gan
stress_runs\20260120_084954\images\2026\05\31_seed41003.png,05/31/2026,2026-05-31,41003,B,handwriting_gan,pytorch_handwriting_gan
stress_runs\20260120_084954\images\2026\06\01_seed41002.png,06/01/2026,2026-06-01,41002,B,handwriting_gan,pytorch_handwriting_gan
stress_runs\20260120_084954\images\2026\06\01_seed41003.png,06/01/2026,2026-06-01,41003,B,handwriting_gan,pytorch_handwriting_gan
stress_runs\20260120_084954\images\2026\06\01_seed41004.png,06/01/2026,2026-06-01,41004,B,handwriting_gan,pytorch_handwriting_gan
stress_runs\20260120_084954\images\2026\06\02_seed41003.png,06/02/2026,2026-06-02,41003,B,handwriting_gan,pytorch_handwriting_gan
stress_runs\20260120_084954\images\2026\06\02_seed41004.png,06/02/2026,2026-06-02,41004,B,handwriting_gan,pytorch_handwriting_gan
stress_runs\20260120_084954\images\2026\06\02_seed41005.png,06/02/2026,2026-06-02,41005,B,handwriting_gan,pytorch_handwriting_gan
stress_runs\20260120_084954\images\2026\06\03_seed41004.png,06/03/2026,2026-06-03,41004,B,handwriting_gan,pytorch_handwriting_gan
stress_runs\20260120_084954\images\2026\06\03_seed41005.png,06/03/2026,2026-06-03,41005,B,handwriting_gan,pytorch_handwriting_gan
stress_runs\20260120_084954\images\2026\06\03_seed41006.png,06/03/2026,2026-06-03,41006,B,handwriting_gan,pytorch_handwriting_gan
stress_runs\20260120_084954\images\2026\06\04_seed41005.png,06/04/2026,2026-06-04,41005,B,handwriting_gan,pytorch_handwriting_gan
stress_runs\20260120_084954\images\2026\06\04_seed41006.png,06/04/2026,2026-06-04,41006,B,handwriting_gan,pytorch_handwriting_gan
stress_runs\20260120_084954\images\2026\06\04_seed41007.png,06/04/2026,2026-06-04,41007,B,handwriting_gan,pytorch_handwriting_gan
stress_runs\20260120_084954\images\2026\06\05_seed41006.png,06/05/2026,2026-06-05,41006,B,handwriting_gan,pytorch_handwriting_gan
stress_runs\20260120_084954\images\2026\06\05_seed41007.png,06/05/2026,2026-06-05,41007,B,handwriting_gan,pytorch_handwriting_gan
stress_runs\20260120_084954\images\2026\06\05_seed41008.png,06/05/2026,2026-06-05,41008,B,handwriting_gan,pytorch_handwriting_gan
stress_runs\20260120_084954\images\2026\06\06_seed41007.png,06/06/2026,2026-06-06,41007,B,handwriting_gan,pytorch_handwriting_gan
stress_runs\20260120_084954\images\2026\06\06_seed41008.png,06/06/2026,2026-06-06,41008,B,handwriting_gan,pytorch_handwriting_gan
stress_runs\20260120_084954\images\2026\06\06_seed41009.png,06/06/2026,2026-06-06,41009,B,handwriting_gan,pytorch_handwriting_gan
stress_runs\20260120_084954\images\2026\06\07_seed41008.png,06/07/2026,2026-06-07,41008,B,handwriting_gan,pytorch_handwriting_gan
stress_runs\20260120_084954\images\2026\06\07_seed41009.png,06/07/2026,2026-06-07,41009,B,handwriting_gan,pytorch_handwriting_gan
stress_runs\20260120_084954\images\2026\06\07_seed41010.png,06/07/2026,2026-06-07,41010,B,handwriting_gan,pytorch_handwriting_gan
stress_runs\20260120_084954\images\2026\06\08_seed41009.png,06/08/2026,2026-06-08,41009,B,handwriting_gan,pytorch_handwriting_gan
stress_runs\20260120_084954\images\2026\06\08_seed41010.png,06/08/2026,2026-06-08,41010,B,handwriting_gan,pytorch_handwriting_gan
stress_runs\20260120_084954\images\2026\06\08_seed41011.png,06/08/2026,2026-06-08,41011,B,handwriting_gan,pytorch_handwriting_gan
stress_runs\20260120_084954\images\2026\06\09_seed41010.png,06/09/2026,2026-06-09,41010,B,handwriting_gan,pytorch_handwriting_gan
stress_runs\20260120_084954\images\2026\06\09_seed41011.png,06/09/2026,2026-06-09,41011,B,handwriting_gan,pytorch_handwriting_gan
stress_runs\20260120_084954\images\2026\06\09_seed41012.png,06/09/2026,2026-06-09,41012,B,handwriting_gan,pytorch_handwriting_gan
stress_runs\20260120_084954\images\2026\06\10_seed41011.png,06/10/2026,2026-06-10,41011,B,handwriting_gan,pytorch_handwriting_gan
stress_runs\20260120_084954\images\2026\06\10_seed41012.png,06/10/2026,2026-06-10,41012,B,handwriting_gan,pytorch_handwriting_gan
stress_runs\20260120_084954\images\2026\06\10_seed41013.png,06/10/2026,2026-06-10,41013,B,handwriting_gan,pytorch_handwriting_gan
stress_runs\20260120_084954\images\2026\06\11_seed41012.png,06/11/2026,2026-06-11,41012,B,handwriting_gan,pytorch_handwriting_gan
stress_runs\20260120_084954\images\2026\06\11_seed41013.png,06/11/2026,2026-06-11,41013,B,handwriting_gan,pytorch_handwriting_gan
stress_runs\20260120_084954\images\2026\06\11_seed41014.png,06/11/2026,2026-06-11,41014,B,handwriting_gan,pytorch_handwriting_gan
stress_runs\20260120_084954\images\2026\06\12_seed41013.png,06/12/2026,2026-06-12,41013,B,handwriting_gan,pytorch_handwriting_gan
stress_runs\20260120_084954\images\2026\06\12_seed41014.png,06/12/2026,2026-06-12,41014,B,handwriting_gan,pytorch_handwriting_gan
stress_runs\20260120_084954\images\2026\06\12_seed41015.png,06/12/2026,2026-06-12,41015,B,handwriting_gan,pytorch_handwriting_gan
stress_runs\20260120_084954\images\2026\06\13_seed41014.png,06/13/2026,2026-06-13,41014,B,handwriting_gan,pytorch_handwriting_gan
stress_runs\20260120_084954\images\2026\06\13_seed41015.png,06/13/2026,2026-06-13,41015,B,handwriting_gan,pytorch_handwriting_gan
stress_runs\20260120_084954\images\2026\06\13_seed41016.png,06/13/2026,2026-06-13,41016,B,handwriting_gan,pytorch_handwriting_gan
stress_runs\20260120_084954\images\2026\06\14_seed41015.png,06/14/2026,2026-06-14,41015,B,handwriting_gan,pytorch_handwriting_gan
stress_runs\20260120_084954\images\2026\06\14_seed41016.png,06/14/2026,2026-06-14,41016,B,handwriting_gan,pytorch_handwriting_gan
stress_runs\20260120_084954\images\2026\06\14_seed41017.png,06/14/2026,2026-06-14,41017,B,handwriting_gan,pytorch_handwriting_gan
stress_runs\20260120_084954\images\2026\06\15_seed41016.png,06/15/2026,2026-06-15,41016,B,handwriting_gan,pytorch_handwriting_gan
stress_runs\20260120_084954\images\2026\06\15_seed41017.png,06/15/2026,2026-06-15,41017,B,handwriting_gan,pytorch_handwriting_gan
stress_runs\20260120_084954\images\2026\06\15_seed41018.png,06/15/2026,2026-06-15,41018,B,handwriting_gan,pytorch_handwriting_gan
stress_runs\20260120_084954\images\2026\06\16_seed41017.png,06/16/2026,2026-06-16,41017,B,handwriting_gan,pytorch_handwriting_gan
stress_runs\20260120_084954\images\2026\06\16_seed41018.png,06/16/2026,2026-06-16,41018,B,handwriting_gan,pytorch_handwriting_gan
stress_runs\20260120_084954\images\2026\06\16_seed41019.png,06/16/2026,2026-06-16,41019,B,handwriting_gan,pytorch_handwriting_gan
stress_runs\20260120_084954\images\2026\06\17_seed41018.png,06/17/2026,2026-06-17,41018,B,handwriting_gan,pytorch_handwriting_gan
stress_runs\20260120_084954\images\2026\06\17_seed41019.png,06/17/2026,2026-06-17,41019,B,handwriting_gan,pytorch_handwriting_gan
stress_runs\20260120_084954\images\2026\06\17_seed41020.png,06/17/2026,2026-06-17,41020,B,handwriting_gan,pytorch_handwriting_gan
stress_runs\20260120_084954\images\2026\06\18_seed41019.png,06/18/2026,2026-06-18,41019,B,handwriting_gan,pytorch_handwriting_gan
stress_runs\20260120_084954\images\2026\06\18_seed41020.png,06/18/2026,2026-06-18,41020,B,handwriting_gan,pytorch_handwriting_gan
stress_runs\20260120_084954\images\2026\06\18_seed41021.png,06/18/2026,2026-06-18,41021,B,handwriting_gan,pytorch_handwriting_gan
stress_runs\20260120_084954\images\2026\06\19_seed41020.png,06/19/2026,2026-06-19,41020,B,handwriting_gan,pytorch_handwriting_gan
stress_runs\20260120_084954\images\2026\06\19_seed41021.png,06/19/2026,2026-06-19,41021,B,handwriting_gan,pytorch_handwriting_gan
stress_runs\20260120_084954\images\2026\06\19_seed41022.png,06/19/2026,2026-06-19,41022,B,handwriting_gan,pytorch_handwriting_gan
stress_runs\20260120_084954\images\2026\06\20_seed41021.png,06/20/2026,2026-06-20,41021,B,handwriting_gan,pytorch_handwriting_gan
stress_runs\20260120_084954\images\2026\06\20_seed41022.png,06/20/2026,2026-06-20,41022,B,handwriting_gan,pytorch_handwriting_gan
stress_runs\20260120_084954\images\2026\06\20_seed41023.png,06/20/2026,2026-06-20,41023,B,handwriting_gan,pytorch_handwriting_gan
stress_runs\20260120_084954\images\2026\06\21_seed41022.png,06/21/2026,2026-06-21,41022,B,handwriting_gan,pytorch_handwriting_gan
stress_runs\20260120_084954\images\2026\06\21_seed41023.png,06/21/2026,2026-06-21,41023,B,handwriting_gan,pytorch_handwriting_gan
stress_runs\20260120_084954\images\2026\06\21_seed41024.png,06/21/2026,2026-06-21,41024,B,handwriting_gan,pytorch_handwriting_gan
stress_runs\20260120_084954\images\2026\06\22_seed41023.png,06/22/2026,2026-06-22,41023,B,handwriting_gan,pytorch_handwriting_gan
stress_runs\20260120_084954\images\2026\06\22_seed41024.png,06/22/2026,2026-06-22,41024,B,handwriting_gan,pytorch_handwriting_gan
stress_runs\20260120_084954\images\2026\06\22_seed41025.png,06/22/2026,2026-06-22,41025,B,handwriting_gan,pytorch_handwriting_gan
stress_runs\20260120_084954\images\2026\06\23_seed41024.png,06/23/2026,2026-06-23,41024,B,handwriting_gan,pytorch_handwriting_gan
stress_runs\20260120_084954\images\2026\06\23_seed41025.png,06/23/2026,2026-06-23,41025,B,handwriting_gan,pytorch_handwriting_gan
stress_runs\20260120_084954\images\2026\06\23_seed41026.png,06/23/2026,2026-06-23,41026,B,handwriting_gan,pytorch_handwriting_gan
stress_runs\20260120_084954\images\2026\06\24_seed41025.png,06/24/2026,2026-06-24,41025,B,handwriting_gan,pytorch_handwriting_gan
stress_runs\20260120_084954\images\2026\06\24_seed41026.png,06/24/2026,2026-06-24,41026,B,handwriting_gan,pytorch_handwriting_gan
stress_runs\20260120_084954\images\2026\06\24_seed41027.png,06/24/2026,2026-06-24,41027,B,handwriting_gan,pytorch_handwriting_gan
stress_runs\20260120_084954\images\2026\06\25_seed41026.png,06/25/2026,2026-06-25,41026,B,handwriting_gan,pytorch_handwriting_gan
stress_runs\20260120_084954\images\2026\06\25_seed41027.png,06/25/2026,2026-06-25,41027,B,handwriting_gan,pytorch_handwriting_gan
stress_runs\20260120_084954\images\2026\06\25_seed41028.png,06/25/2026,2026-06-25,41028,B,handwriting_gan,pytorch_handwriting_gan
stress_runs\20260120_084954\images\2026\06\26_seed41027.png,06/26/2026,2026-06-26,41027,B,handwriting_gan,pytorch_handwriting_gan
stress_runs\20260120_084954\images\2026\06\26_seed41028.png,06/26/2026,2026-06-26,41028,B,handwriting_gan,pytorch_handwriting_gan
stress_runs\20260120_084954\images\2026\06\26_seed41029.png,06/26/2026,2026-06-26,41029,B,handwriting_gan,pytorch_handwriting_gan
stress_runs\20260120_084954\images\2026\06\27_seed41028.png,06/27/2026,2026-06-27,41028,B,handwriting_gan,pytorch_handwriting_gan
stress_runs\20260120_084954\images\2026\06\27_seed41029.png,06/27/2026,2026-06-27,41029,B,handwriting_gan,pytorch_handwriting_gan
stress_runs\20260120_084954\images\2026\06\27_seed41030.png,06/27/2026,2026-06-27,41030,B,handwriting_gan,pytorch_handwriting_gan
stress_runs\20260120_084954\images\2026\06\28_seed41029.png,06/28/2026,2026-06-28,41029,B,handwriting_gan,pytorch_handwriting_gan
stress_runs\20260120_084954\images\2026\06\28_seed41030.png,06/28/2026,2026-06-28,41030,B,handwriting_gan,pytorch_handwriting_gan
stress_runs\20260120_084954\images\2026\06\28_seed41031.png,06/28/2026,2026-06-28,41031,B,handwriting_gan,pytorch_handwriting_gan
stress_runs\20260120_084954\images\2026\06\29_seed41030.png,06/29/2026,2026-06-29,41030,B,handwriting_gan,pytorch_handwriting_gan
stress_runs\20260120_084954\images\2026\06\29_seed41031.png,06/29/2026,2026-06-29,41031,B,handwriting_gan,pytorch_handwriting_gan
stress_runs\20260120_084954\images\2026\06\29_seed41032.png,06/29/2026,2026-06-29,41032,B,handwriting_gan,pytorch_handwriting_gan
stress_runs\20260120_084954\images\2026\06\30_seed41031.png,06/30/2026,2026-06-30,41031,B,handwriting_gan,pytorch_handwriting_gan
stress_runs\20260120_084954\images\2026\06\30_seed41032.png,06/30/2026,2026-06-30,41032,B,handwriting_gan,pytorch_handwriting_gan
stress_runs\20260120_084954\images\2026\06\30_seed41033.png,06/30/2026,2026-06-30,41033,B,handwriting_gan,pytorch_handwriting_gan
stress_runs\20260120_084954\images\2026\07\01_seed41032.png,07/01/2026,2026-07-01,41032,B,handwriting_gan,pytorch_handwriting_gan
stress_runs\20260120_084954\images\2026\07\01_seed41033.png,07/01/2026,2026-07-01,41033,B,handwriting_gan,pytorch_handwriting_gan
stress_runs\20260120_084954\images\2026\07\01_seed41034.png,07/01/2026,2026-07-01,41034,B,handwriting_gan,pytorch_handwriting_gan
stress_runs\20260120_084954\images\2026\07\02_seed41033.png,07/02/2026,2026-07-02,41033,B,handwriting_gan,pytorch_handwriting_gan
stress_runs\20260120_084954\images\2026\07\02_seed41034.png,07/02/2026,2026-07-02,41034,B,handwriting_gan,pytorch_handwriting_gan
stress_runs\20260120_084954\images\2026\07\02_seed41035.png,07/02/2026,2026-07-02,41035,B,handwriting_gan,pytorch_handwriting_gan
stress_runs\20260120_084954\images\2026\07\03_seed41034.png,07/03/2026,2026-07-03,41034,B,handwriting_gan,pytorch_handwriting_gan
stress_runs\20260120_084954\images\2026\07\03_seed41035.png,07/03/2026,2026-07-03,41035,B,handwriting_gan,pytorch_handwriting_gan
stress_runs\20260120_084954\images\2026\07\03_seed41036.png,07/03/2026,2026-07-03,41036,B,handwriting_gan,pytorch_handwriting_gan
stress_runs\20260120_084954\images\2026\07\04_seed41035.png,07/04/2026,2026-07-04,41035,B,handwriting_gan,pytorch_handwriting_gan
stress_runs\20260120_084954\images\2026\07\04_seed41036.png,07/04/2026,2026-07-04,41036,B,handwriting_gan,pytorch_handwriting_gan
stress_runs\20260120_084954\images\2026\07\04_seed41037.png,07/04/2026,2026-07-04,41037,B,handwriting_gan,pytorch_handwriting_gan
stress_runs\20260120_084954\images\2026\07\05_seed41036.png,07/05/2026,2026-07-05,41036,B,handwriting_gan,pytorch_handwriting_gan
stress_runs\20260120_084954\images\2026\07\05_seed41037.png,07/05/2026,2026-07-05,41037,B,handwriting_gan,pytorch_handwriting_gan
stress_runs\20260120_084954\images\2026\07\05_seed41038.png,07/05/2026,2026-07-05,41038,B,handwriting_gan,pytorch_handwriting_gan
stress_runs\20260120_084954\images\2026\07\06_seed41037.png,07/06/2026,2026-07-06,41037,B,handwriting_gan,pytorch_handwriting_gan
stress_runs\20260120_084954\images\2026\07\06_seed41038.png,07/06/2026,2026-07-06,41038,B,handwriting_gan,pytorch_handwriting_gan
stress_runs\20260120_084954\images\2026\07\06_seed41039.png,07/06/2026,2026-07-06,41039,B,handwriting_gan,pytorch_handwriting_gan
stress_runs\20260120_084954\images\2026\07\07_seed41038.png,07/07/2026,2026-07-07,41038,B,handwriting_gan,pytorch_handwriting_gan
stress_runs\20260120_084954\images\2026\07\07_seed41039.png,07/07/2026,2026-07-07,41039,B,handwriting_gan,pytorch_handwriting_gan
stress_runs\20260120_084954\images\2026\07\07_seed41040.png,07/07/2026,2026-07-07,41040,B,handwriting_gan,pytorch_handwriting_gan
stress_runs\20260120_084954\images\2026\07\08_seed41039.png,07/08/2026,2026-07-08,41039,B,handwriting_gan,pytorch_handwriting_gan
stress_runs\20260120_084954\images\2026\07\08_seed41040.png,07/08/2026,2026-07-08,41040,B,handwriting_gan,pytorch_handwriting_gan
stress_runs\20260120_084954\images\2026\07\08_seed41041.png,07/08/2026,2026-07-08,41041,B,handwriting_gan,pytorch_handwriting_gan
stress_runs\20260120_084954\images\2026\07\09_seed41040.png,07/09/2026,2026-07-09,41040,B,handwriting_gan,pytorch_handwriting_gan
stress_runs\20260120_084954\images\2026\07\09_seed41041.png,07/09/2026,2026-07-09,41041,B,handwriting_gan,pytorch_handwriting_gan
stress_runs\20260120_084954\images\2026\07\09_seed41042.png,07/09/2026,2026-07-09,41042,B,handwriting_gan,pytorch_handwriting_gan
stress_runs\20260120_084954\images\2026\07\10_seed41041.png,07/10/2026,2026-07-10,41041,B,handwriting_gan,pytorch_handwriting_gan
stress_runs\20260120_084954\images\2026\07\10_seed41042.png,07/10/2026,2026-07-10,41042,B,handwriting_gan,pytorch_handwriting_gan
stress_runs\20260120_084954\images\2026\07\10_seed41043.png,07/10/2026,2026-07-10,41043,B,handwriting_gan,pytorch_handwriting_gan
stress_runs\20260120_084954\images\2026\07\11_seed41042.png,07/11/2026,2026-07-11,41042,B,handwriting_gan,pytorch_handwriting_gan
stress_runs\20260120_084954\images\2026\07\11_seed41043.png,07/11/2026,2026-07-11,41043,B,handwriting_gan,pytorch_handwriting_gan
stress_runs\20260120_084954\images\2026\07\11_seed41044.png,07/11/2026,2026-07-11,41044,B,handwriting_gan,pytorch_handwriting_gan
stress_runs\20260120_084954\images\2026\07\12_seed41043.png,07/12/2026,2026-07-12,41043,B,handwriting_gan,pytorch_handwriting_gan
stress_runs\20260120_084954\images\2026\07\12_seed41044.png,07/12/2026,2026-07-12,41044,B,handwriting_gan,pytorch_handwriting_gan
stress_runs\20260120_084954\images\2026\07\12_seed41045.png,07/12/2026,2026-07-12,41045,B,handwriting_gan,pytorch_handwriting_gan
stress_runs\20260120_084954\images\2026\07\13_seed41044.png,07/13/2026,2026-07-13,41044,B,handwriting_gan,pytorch_handwriting_gan
stress_runs\20260120_084954\images\2026\07\13_seed41045.png,07/13/2026,2026-07-13,41045,B,handwriting_gan,pytorch_handwriting_gan
stress_runs\20260120_084954\images\2026\07\13_seed41046.png,07/13/2026,2026-07-13,41046,B,handwriting_gan,pytorch_handwriting_gan
stress_runs\20260120_084954\images\2026\07\14_seed41045.png,07/14/2026,2026-07-14,41045,B,handwriting_gan,pytorch_handwriting_gan
stress_runs\20260120_084954\images\2026\07\14_seed41046.png,07/14/2026,2026-07-14,41046,B,handwriting_gan,pytorch_handwriting_gan
stress_runs\20260120_084954\images\2026\07\14_seed41047.png,07/14/2026,2026-07-14,41047,B,handwriting_gan,pytorch_handwriting_gan
stress_runs\20260120_084954\images\2026\07\15_seed41046.png,07/15/2026,2026-07-15,41046,B,handwriting_gan,pytorch_handwriting_gan
stress_runs\20260120_084954\images\2026\07\15_seed41047.png,07/15/2026,2026-07-15,41047,B,handwriting_gan,pytorch_handwriting_gan
stress_runs\20260120_084954\images\2026\07\15_seed41048.png,07/15/2026,2026-07-15,41048,B,handwriting_gan,pytorch_handwriting_gan
stress_runs\20260120_084954\images\2026\07\16_seed41047.png,07/16/2026,2026-07-16,41047,B,handwriting_gan,pytorch_handwriting_gan
stress_runs\20260120_084954\images\2026\07\16_seed41048.png,07/16/2026,2026-07-16,41048,B,handwriting_gan,pytorch_handwriting_gan
stress_runs\20260120_084954\images\2026\07\16_seed41049.png,07/16/2026,2026-07-16,41049,B,handwriting_gan,pytorch_handwriting_gan
stress_runs\20260120_084954\images\2026\07\17_seed41048.png,07/17/2026,2026-07-17,41048,B,handwriting_gan,pytorch_handwriting_gan
stress_runs\20260120_084954\images\2026\07\17_seed41049.png,07/17/2026,2026-07-17,41049,B,handwriting_gan,pytorch_handwriting_gan
stress_runs\20260120_084954\images\2026\07\17_seed41050.png,07/17/2026,2026-07-17,41050,B,handwriting_gan,pytorch_handwriting_gan
stress_runs\20260120_084954\images\2026\07\18_seed41049.png,07/18/2026,2026-07-18,41049,B,handwriting_gan,pytorch_handwriting_gan
stress_runs\20260120_084954\images\2026\07\18_seed41050.png,07/18/2026,2026-07-18,41050,B,handwriting_gan,pytorch_handwriting_gan
stress_runs\20260120_084954\images\2026\07\18_seed41051.png,07/18/2026,2026-07-18,41051,B,handwriting_gan,pytorch_handwriting_gan
stress_runs\20260120_084954\images\2026\07\19_seed41050.png,07/19/2026,2026-07-19,41050,B,handwriting_gan,pytorch_handwriting_gan
stress_runs\20260120_084954\images\2026\07\19_seed41051.png,07/19/2026,2026-07-19,41051,B,handwriting_gan,pytorch_handwriting_gan
stress_runs\20260120_084954\images\2026\07\19_seed41052.png,07/19/2026,2026-07-19,41052,B,handwriting_gan,pytorch_handwriting_gan
stress_runs\20260120_084954\images\2026\07\20_seed41051.png,07/20/2026,2026-07-20,41051,B,handwriting_gan,pytorch_handwriting_gan
stress_runs\20260120_084954\images\2026\07\20_seed41052.png,07/20/2026,2026-07-20,41052,B,handwriting_gan,pytorch_handwriting_gan
stress_runs\20260120_084954\images\2026\07\20_seed41053.png,07/20/2026,2026-07-20,41053,B,handwriting_gan,pytorch_handwriting_gan
stress_runs\20260120_084954\images\2026\07\21_seed41052.png,07/21/2026,2026-07-21,41052,B,handwriting_gan,pytorch_handwriting_gan
stress_runs\20260120_084954\images\2026\07\21_seed41053.png,07/21/2026,2026-07-21,41053,B,handwriting_gan,pytorch_handwriting_gan
stress_runs\20260120_084954\images\2026\07\21_seed41054.png,07/21/2026,2026-07-21,41054,B,handwriting_gan,pytorch_handwriting_gan
stress_runs\20260120_084954\images\2026\07\22_seed41053.png,07/22/2026,2026-07-22,41053,B,handwriting_gan,pytorch_handwriting_gan
stress_runs\20260120_084954\images\2026\07\22_seed41054.png,07/22/2026,2026-07-22,41054,B,handwriting_gan,pytorch_handwriting_gan
stress_runs\20260120_084954\images\2026\07\22_seed41055.png,07/22/2026,2026-07-22,41055,B,handwriting_gan,pytorch_handwriting_gan
stress_runs\20260120_084954\images\2026\07\23_seed41054.png,07/23/2026,2026-07-23,41054,B,handwriting_gan,pytorch_handwriting_gan
stress_runs\20260120_084954\images\2026\07\23_seed41055.png,07/23/2026,2026-07-23,41055,B,handwriting_gan,pytorch_handwriting_gan
stress_runs\20260120_084954\images\2026\07\23_seed41056.png,07/23/2026,2026-07-23,41056,B,handwriting_gan,pytorch_handwriting_gan
stress_runs\20260120_084954\images\2026\07\24_seed41055.png,07/24/2026,2026-07-24,41055,B,handwriting_gan,pytorch_handwriting_gan
stress_runs\20260120_084954\images\2026\07\24_seed41056.png,07/24/2026,2026-07-24,41056,B,handwriting_gan,pytorch_handwriting_gan
stress_runs\20260120_084954\images\2026\07\24_seed41057.png,07/24/2026,2026-07-24,41057,B,handwriting_gan,pytorch_handwriting_gan
stress_runs\20260120_084954\images\2026\07\25_seed41056.png,07/25/2026,2026-07-25,41056,B,handwriting_gan,pytorch_handwriting_gan
stress_runs\20260120_084954\images\2026\07\25_seed41057.png,07/25/2026,2026-07-25,41057,B,handwriting_gan,pytorch_handwriting_gan
stress_runs\20260120_084954\images\2026\07\25_seed41058.png,07/25/2026,2026-07-25,41058,B,handwriting_gan,pytorch_handwriting_gan
stress_runs\20260120_084954\images\2026\07\26_seed41057.png,07/26/2026,2026-07-26,41057,B,handwriting_gan,pytorch_handwriting_gan
stress_runs\20260120_084954\images\2026\07\26_seed41058.png,07/26/2026,2026-07-26,41058,B,handwriting_gan,pytorch_handwriting_gan
stress_runs\20260120_084954\images\2026\07\26_seed41059.png,07/26/2026,2026-07-26,41059,B,handwriting_gan,pytorch_handwriting_gan
stress_runs\20260120_084954\images\2026\07\27_seed41058.png,07/27/2026,2026-07-27,41058,B,handwriting_gan,pytorch_handwriting_gan
stress_runs\20260120_084954\images\2026\07\27_seed41059.png,07/27/2026,2026-07-27,41059,B,handwriting_gan,pytorch_handwriting_gan
stress_runs\20260120_084954\images\2026\07\27_seed41060.png,07/27/2026,2026-07-27,41060,B,handwriting_gan,pytorch_handwriting_gan
stress_runs\20260120_084954\images\2026\07\28_seed41059.png,07/28/2026,2026-07-28,41059,B,handwriting_gan,pytorch_handwriting_gan
stress_runs\20260120_084954\images\2026\07\28_seed41060.png,07/28/2026,2026-07-28,41060,B,handwriting_gan,pytorch_handwriting_gan
stress_runs\20260120_084954\images\2026\07\28_seed41061.png,07/28/2026,2026-07-28,41061,B,handwriting_gan,pytorch_handwriting_gan
stress_runs\20260120_084954\images\2026\07\29_seed41060.png,07/29/2026,2026-07-29,41060,B,handwriting_gan,pytorch_handwriting_gan
stress_runs\20260120_084954\images\2026\07\29_seed41061.png,07/29/2026,2026-07-29,41061,B,handwriting_gan,pytorch_handwriting_gan
stress_runs\20260120_084954\images\2026\07\29_seed41062.png,07/29/2026,2026-07-29,41062,B,handwriting_gan,pytorch_handwriting_gan
stress_runs\20260120_084954\images\2026\07\30_seed41061.png,07/30/2026,2026-07-30,41061,B,handwriting_gan,pytorch_handwriting_gan
stress_runs\20260120_084954\images\2026\07\30_seed41062.png,07/30/2026,2026-07-30,41062,B,handwriting_gan,pytorch_handwriting_gan
stress_runs\20260120_084954\images\2026\07\30_seed41063.png,07/30/2026,2026-07-30,41063,B,handwriting_gan,pytorch_handwriting_gan
stress_runs\20260120_084954\images\2026\07\31_seed41062.png,07/31/2026,2026-07-31,41062,B,handwriting_gan,pytorch_handwriting_gan
stress_runs\20260120_084954\images\2026\07\31_seed41063.png,07/31/2026,2026-07-31,41063,B,handwriting_gan,pytorch_handwriting_gan
stress_runs\20260120_084954\images\2026\07\31_seed41064.png,07/31/2026,2026-07-31,41064,B,handwriting_gan,pytorch_handwriting_gan
stress_runs\20260120_084954\images\2026\08\01_seed41063.png,08/01/2026,2026-08-01,41063,B,handwriting_gan,pytorch_handwriting_gan
stress_runs\20260120_084954\images\2026\08\01_seed41064.png,08/01/2026,2026-08-01,41064,B,handwriting_gan,pytorch_handwriting_gan
stress_runs\20260120_084954\images\2026\08\01_seed41065.png,08/01/2026,2026-08-01,41065,B,handwriting_gan,pytorch_handwriting_gan
stress_runs\20260120_084954\images\2026\08\02_seed41064.png,08/02/2026,2026-08-02,41064,B,handwriting_gan,pytorch_handwriting_gan
stress_runs\20260120_084954\images\2026\08\02_seed41065.png,08/02/2026,2026-08-02,41065,B,handwriting_gan,pytorch_handwriting_gan
stress_runs\20260120_084954\images\2026\08\02_seed41066.png,08/02/2026,2026-08-02,41066,B,handwriting_gan,pytorch_handwriting_gan
stress_runs\20260120_084954\images\2026\08\03_seed41065.png,08/03/2026,2026-08-03,41065,B,handwriting_gan,pytorch_handwriting_gan
stress_runs\20260120_084954\images\2026\08\03_seed41066.png,08/03/2026,2026-08-03,41066,B,handwriting_gan,pytorch_handwriting_gan
stress_runs\20260120_084954\images\2026\08\03_seed41067.png,08/03/2026,2026-08-03,41067,B,handwriting_gan,pytorch_handwriting_gan
stress_runs\20260120_084954\images\2026\08\04_seed41066.png,08/04/2026,2026-08-04,41066,B,handwriting_gan,pytorch_handwriting_gan
stress_runs\20260120_084954\images\2026\08\04_seed41067.png,08/04/2026,2026-08-04,41067,B,handwriting_gan,pytorch_handwriting_gan
stress_runs\20260120_084954\images\2026\08\04_seed41068.png,08/04/2026,2026-08-04,41068,B,handwriting_gan,pytorch_handwriting_gan
stress_runs\20260120_084954\images\2026\08\05_seed41067.png,08/05/2026,2026-08-05,41067,B,handwriting_gan,pytorch_handwriting_gan
stress_runs\20260120_084954\images\2026\08\05_seed41068.png,08/05/2026,2026-08-05,41068,B,handwriting_gan,pytorch_handwriting_gan
stress_runs\20260120_084954\images\2026\08\05_seed41069.png,08/05/2026,2026-08-05,41069,B,handwriting_gan,pytorch_handwriting_gan
stress_runs\20260120_084954\images\2026\08\06_seed41068.png,08/06/2026,2026-08-06,41068,B,handwriting_gan,pytorch_handwriting_gan
stress_runs\20260120_084954\images\2026\08\06_seed41069.png,08/06/2026,2026-08-06,41069,B,handwriting_gan,pytorch_handwriting_gan
stress_runs\20260120_084954\images\2026\08\06_seed41070.png,08/06/2026,2026-08-06,41070,B,handwriting_gan,pytorch_handwriting_gan
stress_runs\20260120_084954\images\2026\08\07_seed41069.png,08/07/2026,2026-08-07,41069,B,handwriting_gan,pytorch_handwriting_gan
stress_runs\20260120_084954\images\2026\08\07_seed41070.png,08/07/2026,2026-08-07,41070,B,handwriting_gan,pytorch_handwriting_gan
stress_runs\20260120_084954\images\2026\08\07_seed41071.png,08/07/2026,2026-08-07,41071,B,handwriting_gan,pytorch_handwriting_gan
stress_runs\20260120_084954\images\2026\08\08_seed41070.png,08/08/2026,2026-08-08,41070,B,handwriting_gan,pytorch_handwriting_gan
stress_runs\20260120_084954\images\2026\08\08_seed41071.png,08/08/2026,2026-08-08,41071,B,handwriting_gan,pytorch_handwriting_gan
stress_runs\20260120_084954\images\2026\08\08_seed41072.png,08/08/2026,2026-08-08,41072,B,handwriting_gan,pytorch_handwriting_gan
stress_runs\20260120_084954\images\2026\08\09_seed41071.png,08/09/2026,2026-08-09,41071,B,handwriting_gan,pytorch_handwriting_gan
stress_runs\20260120_084954\images\2026\08\09_seed41072.png,08/09/2026,2026-08-09,41072,B,handwriting_gan,pytorch_handwriting_gan
stress_runs\20260120_084954\images\2026\08\09_seed41073.png,08/09/2026,2026-08-09,41073,B,handwriting_gan,pytorch_handwriting_gan
stress_runs\20260120_084954\images\2026\08\10_seed41072.png,08/10/2026,2026-08-10,41072,B,handwriting_gan,pytorch_handwriting_gan
stress_runs\20260120_084954\images\2026\08\10_seed41073.png,08/10/2026,2026-08-10,41073,B,handwriting_gan,pytorch_handwriting_gan
stress_runs\20260120_084954\images\2026\08\10_seed41074.png,08/10/2026,2026-08-10,41074,B,handwriting_gan,pytorch_handwriting_gan
stress_runs\20260120_084954\images\2026\08\11_seed41073.png,08/11/2026,2026-08-11,41073,B,handwriting_gan,pytorch_handwriting_gan
stress_runs\20260120_084954\images\2026\08\11_seed41074.png,08/11/2026,2026-08-11,41074,B,handwriting_gan,pytorch_handwriting_gan
stress_runs\20260120_084954\images\2026\08\11_seed41075.png,08/11/2026,2026-08-11,41075,B,handwriting_gan,pytorch_handwriting_gan
stress_runs\20260120_084954\images\2026\08\12_seed41074.png,08/12/2026,2026-08-12,41074,B,handwriting_gan,pytorch_handwriting_gan
stress_runs\20260120_084954\images\2026\08\12_seed41075.png,08/12/2026,2026-08-12,41075,B,handwriting_gan,pytorch_handwriting_gan
stress_runs\20260120_084954\images\2026\08\12_seed41076.png,08/12/2026,2026-08-12,41076,B,handwriting_gan,pytorch_handwriting_gan
stress_runs\20260120_084954\images\2026\08\13_seed41075.png,08/13/2026,2026-08-13,41075,B,handwriting_gan,pytorch_handwriting_gan
stress_runs\20260120_084954\images\2026\08\13_seed41076.png,08/13/2026,2026-08-13,41076,B,handwriting_gan,pytorch_handwriting_gan
stress_runs\20260120_084954\images\2026\08\13_seed41077.png,08/13/2026,2026-08-13,41077,B,handwriting_gan,pytorch_handwriting_gan
stress_runs\20260120_084954\images\2026\08\14_seed41076.png,08/14/2026,2026-08-14,41076,B,handwriting_gan,pytorch_handwriting_gan
stress_runs\20260120_084954\images\2026\08\14_seed41077.png,08/14/2026,2026-08-14,41077,B,handwriting_gan,pytorch_handwriting_gan
stress_runs\20260120_084954\images\2026\08\14_seed41078.png,08/14/2026,2026-08-14,41078,B,handwriting_gan,pytorch_handwriting_gan
stress_runs\20260120_084954\images\2026\08\15_seed41077.png,08/15/2026,2026-08-15,41077,B,handwriting_gan,pytorch_handwriting_gan
stress_runs\20260120_084954\images\2026\08\15_seed41078.png,08/15/2026,2026-08-15,41078,B,handwriting_gan,pytorch_handwriting_gan
stress_runs\20260120_084954\images\2026\08\15_seed41079.png,08/15/2026,2026-08-15,41079,B,handwriting_gan,pytorch_handwriting_gan
stress_runs\20260120_084954\images\2026\08\16_seed41078.png,08/16/2026,2026-08-16,41078,B,handwriting_gan,pytorch_handwriting_gan
stress_runs\20260120_084954\images\2026\08\16_seed41079.png,08/16/2026,2026-08-16,41079,B,handwriting_gan,pytorch_handwriting_gan
stress_runs\20260120_084954\images\2026\08\16_seed41080.png,08/16/2026,2026-08-16,41080,B,handwriting_gan,pytorch_handwriting_gan
stress_runs\20260120_084954\images\2026\08\17_seed41079.png,08/17/2026,2026-08-17,41079,B,handwriting_gan,pytorch_handwriting_gan
stress_runs\20260120_084954\images\2026\08\17_seed41080.png,08/17/2026,2026-08-17,41080,B,handwriting_gan,pytorch_handwriting_gan
stress_runs\20260120_084954\images\2026\08\17_seed41081.png,08/17/2026,2026-08-17,41081,B,handwriting_gan,pytorch_handwriting_gan
stress_runs\20260120_084954\images\2026\08\18_seed41080.png,08/18/2026,2026-08-18,41080,B,handwriting_gan,pytorch_handwriting_gan
stress_runs\20260120_084954\images\2026\08\18_seed41081.png,08/18/2026,2026-08-18,41081,B,handwriting_gan,pytorch_handwriting_gan
stress_runs\20260120_084954\images\2026\08\18_seed41082.png,08/18/2026,2026-08-18,41082,B,handwriting_gan,pytorch_handwriting_gan
stress_runs\20260120_084954\images\2026\08\19_seed41081.png,08/19/2026,2026-08-19,41081,B,handwriting_gan,pytorch_handwriting_gan
stress_runs\20260120_084954\images\2026\08\19_seed41082.png,08/19/2026,2026-08-19,41082,B,handwriting_gan,pytorch_handwriting_gan
stress_runs\20260120_084954\images\2026\08\19_seed41083.png,08/19/2026,2026-08-19,41083,B,handwriting_gan,pytorch_handwriting_gan
stress_runs\20260120_084954\images\2026\08\20_seed41082.png,08/20/2026,2026-08-20,41082,B,handwriting_gan,pytorch_handwriting_gan
stress_runs\20260120_084954\images\2026\08\20_seed41083.png,08/20/2026,2026-08-20,41083,B,handwriting_gan,pytorch_handwriting_gan
stress_runs\20260120_084954\images\2026\08\20_seed41084.png,08/20/2026,2026-08-20,41084,B,handwriting_gan,pytorch_handwriting_gan
stress_runs\20260120_084954\images\2026\08\21_seed41083.png,08/21/2026,2026-08-21,41083,B,handwriting_gan,pytorch_handwriting_gan
stress_runs\20260120_084954\images\2026\08\21_seed41084.png,08/21/2026,2026-08-21,41084,B,handwriting_gan,pytorch_handwriting_gan
stress_runs\20260120_084954\images\2026\08\21_seed41085.png,08/21/2026,2026-08-21,41085,B,handwriting_gan,pytorch_handwriting_gan
stress_runs\20260120_084954\images\2026\08\22_seed41084.png,08/22/2026,2026-08-22,41084,B,handwriting_gan,pytorch_handwriting_gan
stress_runs\20260120_084954\images\2026\08\22_seed41085.png,08/22/2026,2026-08-22,41085,B,handwriting_gan,pytorch_handwriting_gan
stress_runs\20260120_084954\images\2026\08\22_seed41086.png,08/22/2026,2026-08-22,41086,B,handwriting_gan,pytorch_handwriting_gan
stress_runs\20260120_084954\images\2026\08\23_seed41085.png,08/23/2026,2026-08-23,41085,B,handwriting_gan,pytorch_handwriting_gan
stress_runs\20260120_084954\images\2026\08\23_seed41086.png,08/23/2026,2026-08-23,41086,B,handwriting_gan,pytorch_handwriting_gan
stress_runs\20260120_084954\images\2026\08\23_seed41087.png,08/23/2026,2026-08-23,41087,B,handwriting_gan,pytorch_handwriting_gan
stress_runs\20260120_084954\images\2026\08\24_seed41086.png,08/24/2026,2026-08-24,41086,B,handwriting_gan,pytorch_handwriting_gan
stress_runs\20260120_084954\images\2026\08\24_seed41087.png,08/24/2026,2026-08-24,41087,B,handwriting_gan,pytorch_handwriting_gan
stress_runs\20260120_084954\images\2026\08\24_seed41088.png,08/24/2026,2026-08-24,41088,B,handwriting_gan,pytorch_handwriting_gan
stress_runs\20260120_084954\images\2026\08\25_seed41087.png,08/25/2026,2026-08-25,41087,B,handwriting_gan,pytorch_handwriting_gan
stress_runs\20260120_084954\images\2026\08\25_seed41088.png,08/25/2026,2026-08-25,41088,B,handwriting_gan,pytorch_handwriting_gan
stress_runs\20260120_084954\images\2026\08\25_seed41089.png,08/25/2026,2026-08-25,41089,B,handwriting_gan,pytorch_handwriting_gan
stress_runs\20260120_084954\images\2026\08\26_seed41088.png,08/26/2026,2026-08-26,41088,B,handwriting_gan,pytorch_handwriting_gan
stress_runs\20260120_084954\images\2026\08\26_seed41089.png,08/26/2026,2026-08-26,41089,B,handwriting_gan,pytorch_handwriting_gan
stress_runs\20260120_084954\images\2026\08\26_seed41090.png,08/26/2026,2026-08-26,41090,B,handwriting_gan,pytorch_handwriting_gan
stress_runs\20260120_084954\images\2026\08\27_seed41089.png,08/27/2026,2026-08-27,41089,B,handwriting_gan,pytorch_handwriting_gan
stress_runs\20260120_084954\images\2026\08\27_seed41090.png,08/27/2026,2026-08-27,41090,B,handwriting_gan,pytorch_handwriting_gan
stress_runs\20260120_084954\images\2026\08\27_seed41091.png,08/27/2026,2026-08-27,41091,B,handwriting_gan,pytorch_handwriting_gan
stress_runs\20260120_084954\images\2026\08\28_seed41090.png,08/28/2026,2026-08-28,41090,B,handwriting_gan,pytorch_handwriting_gan
stress_runs\20260120_084954\images\2026\08\28_seed41091.png,08/28/2026,2026-08-28,41091,B,handwriting_gan,pytorch_handwriting_gan
stress_runs\20260120_084954\images\2026\08\28_seed41092.png,08/28/2026,2026-08-28,41092,B,handwriting_gan,pytorch_handwriting_gan
stress_runs\20260120_084954\images\2026\08\29_seed41091.png,08/29/2026,2026-08-29,41091,B,handwriting_gan,pytorch_handwriting_gan
stress_runs\20260120_084954\images\2026\08\29_seed41092.png,08/29/2026,2026-08-29,41092,B,handwriting_gan,pytorch_handwriting_gan
stress_runs\20260120_084954\images\2026\08\29_seed41093.png,08/29/2026,2026-08-29,41093,B,handwriting_gan,pytorch_handwriting_gan
stress_runs\20260120_084954\images\2026\08\30_seed41092.png,08/30/2026,2026-08-30,41092,B,handwriting_gan,pytorch_handwriting_gan
stress_runs\20260120_084954\images\2026\08\30_seed41093.png,08/30/2026,2026-08-30,41093,B,handwriting_gan,pytorch_handwriting_gan
stress_runs\20260120_084954\images\2026\08\30_seed41094.png,08/30/2026,2026-08-30,41094,B,handwriting_gan,pytorch_handwriting_gan
stress_runs\20260120_084954\images\2026\08\31_seed41093.png,08/31/2026,2026-08-31,41093,B,handwriting_gan,pytorch_handwriting_gan
stress_runs\20260120_084954\images\2026\08\31_seed41094.png,08/31/2026,2026-08-31,41094,B,handwriting_gan,pytorch_handwriting_gan
stress_runs\20260120_084954\images\2026\08\31_seed41095.png,08/31/2026,2026-08-31,41095,B,handwriting_gan,pytorch_handwriting_gan
stress_runs\20260120_084954\images\2026\09\01_seed41094.png,09/01/2026,2026-09-01,41094,B,handwriting_gan,pytorch_handwriting_gan
stress_runs\20260120_084954\images\2026\09\01_seed41095.png,09/01/2026,2026-09-01,41095,B,handwriting_gan,pytorch_handwriting_gan
stress_runs\20260120_084954\images\2026\09\01_seed41096.png,09/01/2026,2026-09-01,41096,B,handwriting_gan,pytorch_handwriting_gan
stress_runs\20260120_084954\images\2026\09\02_seed41095.png,09/02/2026,2026-09-02,41095,B,handwriting_gan,pytorch_handwriting_gan
stress_runs\20260120_084954\images\2026\09\02_seed41096.png,09/02/2026,2026-09-02,41096,B,handwriting_gan,pytorch_handwriting_gan
stress_runs\20260120_084954\images\2026\09\02_seed41097.png,09/02/2026,2026-09-02,41097,B,handwriting_gan,pytorch_handwriting_gan
stress_runs\20260120_084954\images\2026\09\03_seed41096.png,09/03/2026,2026-09-03,41096,B,handwriting_gan,pytorch_handwriting_gan
stress_runs\20260120_084954\images\2026\09\03_seed41097.png,09/03/2026,2026-09-03,41097,B,handwriting_gan,pytorch_handwriting_gan
stress_runs\20260120_084954\images\2026\09\03_seed41098.png,09/03/2026,2026-09-03,41098,B,handwriting_gan,pytorch_handwriting_gan
stress_runs\20260120_084954\images\2026\09\04_seed41097.png,09/04/2026,2026-09-04,41097,B,handwriting_gan,pytorch_handwriting_gan
stress_runs\20260120_084954\images\2026\09\04_seed41098.png,09/04/2026,2026-09-04,41098,B,handwriting_gan,pytorch_handwriting_gan
stress_runs\20260120_084954\images\2026\09\04_seed41099.png,09/04/2026,2026-09-04,41099,B,handwriting_gan,pytorch_handwriting_gan
stress_runs\20260120_084954\images\2026\09\05_seed41098.png,09/05/2026,2026-09-05,41098,B,handwriting_gan,pytorch_handwriting_gan
stress_runs\20260120_084954\images\2026\09\05_seed41099.png,09/05/2026,2026-09-05,41099,B,handwriting_gan,pytorch_handwriting_gan
stress_runs\20260120_084954\images\2026\09\05_seed41100.png,09/05/2026,2026-09-05,41100,B,handwriting_gan,pytorch_handwriting_gan
stress_runs\20260120_084954\images\2026\09\06_seed41099.png,09/06/2026,2026-09-06,41099,B,handwriting_gan,pytorch_handwriting_gan
stress_runs\20260120_084954\images\2026\09\06_seed41100.png,09/06/2026,2026-09-06,41100,B,handwriting_gan,pytorch_handwriting_gan
stress_runs\20260120_084954\images\2026\09\06_seed41101.png,09/06/2026,2026-09-06,41101,B,handwriting_gan,pytorch_handwriting_gan
stress_runs\20260120_084954\images\2026\09\07_seed41100.png,09/07/2026,2026-09-07,41100,B,handwriting_gan,pytorch_handwriting_gan
stress_runs\20260120_084954\images\2026\09\07_seed41101.png,09/07/2026,2026-09-07,41101,B,handwriting_gan,pytorch_handwriting_gan
stress_runs\20260120_084954\images\2026\09\07_seed41102.png,09/07/2026,2026-09-07,41102,B,handwriting_gan,pytorch_handwriting_gan
stress_runs\20260120_084954\images\2026\09\08_seed41101.png,09/08/2026,2026-09-08,41101,B,handwriting_gan,pytorch_handwriting_gan
stress_runs\20260120_084954\images\2026\09\08_seed41102.png,09/08/2026,2026-09-08,41102,B,handwriting_gan,pytorch_handwriting_gan
stress_runs\20260120_084954\images\2026\09\08_seed41103.png,09/08/2026,2026-09-08,41103,B,handwriting_gan,pytorch_handwriting_gan
stress_runs\20260120_084954\images\2026\09\09_seed41102.png,09/09/2026,2026-09-09,41102,B,handwriting_gan,pytorch_handwriting_gan
stress_runs\20260120_084954\images\2026\09\09_seed41103.png,09/09/2026,2026-09-09,41103,B,handwriting_gan,pytorch_handwriting_gan
stress_runs\20260120_084954\images\2026\09\09_seed41104.png,09/09/2026,2026-09-09,41104,B,handwriting_gan,pytorch_handwriting_gan
stress_runs\20260120_084954\images\2026\09\10_seed41103.png,09/10/2026,2026-09-10,41103,B,handwriting_gan,pytorch_handwriting_gan
stress_runs\20260120_084954\images\2026\09\10_seed41104.png,09/10/2026,2026-09-10,41104,B,handwriting_gan,pytorch_handwriting_gan
stress_runs\20260120_084954\images\2026\09\10_seed41105.png,09/10/2026,2026-09-10,41105,B,handwriting_gan,pytorch_handwriting_gan
stress_runs\20260120_084954\images\2026\09\11_seed41104.png,09/11/2026,2026-09-11,41104,B,handwriting_gan,pytorch_handwriting_gan
stress_runs\20260120_084954\images\2026\09\11_seed41105.png,09/11/2026,2026-09-11,41105,B,handwriting_gan,pytorch_handwriting_gan
stress_runs\20260120_084954\images\2026\09\11_seed41106.png,09/11/2026,2026-09-11,41106,B,handwriting_gan,pytorch_handwriting_gan
stress_runs\20260120_084954\images\2026\09\12_seed41105.png,09/12/2026,2026-09-12,41105,B,handwriting_gan,pytorch_handwriting_gan
stress_runs\20260120_084954\images\2026\09\12_seed41106.png,09/12/2026,2026-09-12,41106,B,handwriting_gan,pytorch_handwriting_gan
stress_runs\20260120_084954\images\2026\09\12_seed41107.png,09/12/2026,2026-09-12,41107,B,handwriting_gan,pytorch_handwriting_gan
stress_runs\20260120_084954\images\2026\09\13_seed41106.png,09/13/2026,2026-09-13,41106,B,handwriting_gan,pytorch_handwriting_gan
stress_runs\20260120_084954\images\2026\09\13_seed41107.png,09/13/2026,2026-09-13,41107,B,handwriting_gan,pytorch_handwriting_gan
stress_runs\20260120_084954\images\2026\09\13_seed41108.png,09/13/2026,2026-09-13,41108,B,handwriting_gan,pytorch_handwriting_gan
stress_runs\20260120_084954\images\2026\09\14_seed41107.png,09/14/2026,2026-09-14,41107,B,handwriting_gan,pytorch_handwriting_gan
stress_runs\20260120_084954\images\2026\09\14_seed41108.png,09/14/2026,2026-09-14,41108,B,handwriting_gan,pytorch_handwriting_gan
stress_runs\20260120_084954\images\2026\09\14_seed41109.png,09/14/2026,2026-09-14,41109,B,handwriting_gan,pytorch_handwriting_gan
stress_runs\20260120_084954\images\2026\09\15_seed41108.png,09/15/2026,2026-09-15,41108,B,handwriting_gan,pytorch_handwriting_gan
stress_runs\20260120_084954\images\2026\09\15_seed41109.png,09/15/2026,2026-09-15,41109,B,handwriting_gan,pytorch_handwriting_gan
stress_runs\20260120_084954\images\2026\09\15_seed41110.png,09/15/2026,2026-09-15,41110,B,handwriting_gan,pytorch_handwriting_gan
stress_runs\20260120_084954\images\2026\09\16_seed41109.png,09/16/2026,2026-09-16,41109,B,handwriting_gan,pytorch_handwriting_gan
stress_runs\20260120_084954\images\2026\09\16_seed41110.png,09/16/2026,2026-09-16,41110,B,handwriting_gan,pytorch_handwriting_gan
stress_runs\20260120_084954\images\2026\09\16_seed41111.png,09/16/2026,2026-09-16,41111,B,handwriting_gan,pytorch_handwriting_gan
stress_runs\20260120_084954\images\2026\09\17_seed41110.png,09/17/2026,2026-09-17,41110,B,handwriting_gan,pytorch_handwriting_gan
stress_runs\20260120_084954\images\2026\09\17_seed41111.png,09/17/2026,2026-09-17,41111,B,handwriting_gan,pytorch_handwriting_gan
stress_runs\20260120_084954\images\2026\09\17_seed41112.png,09/17/2026,2026-09-17,41112,B,handwriting_gan,pytorch_handwriting_gan
stress_runs\20260120_084954\images\2026\09\18_seed41111.png,09/18/2026,2026-09-18,41111,B,handwriting_gan,pytorch_handwriting_gan
stress_runs\20260120_084954\images\2026\09\18_seed41112.png,09/18/2026,2026-09-18,41112,B,handwriting_gan,pytorch_handwriting_gan
stress_runs\20260120_084954\images\2026\09\18_seed41113.png,09/18/2026,2026-09-18,41113,B,handwriting_gan,pytorch_handwriting_gan
stress_runs\20260120_084954\images\2026\09\19_seed41112.png,09/19/2026,2026-09-19,41112,B,handwriting_gan,pytorch_handwriting_gan
stress_runs\20260120_084954\images\2026\09\19_seed41113.png,09/19/2026,2026-09-19,41113,B,handwriting_gan,pytorch_handwriting_gan
stress_runs\20260120_084954\images\2026\09\19_seed41114.png,09/19/2026,2026-09-19,41114,B,handwriting_gan,pytorch_handwriting_gan
stress_runs\20260120_084954\images\2026\09\20_seed41113.png,09/20/2026,2026-09-20,41113,B,handwriting_gan,pytorch_handwriting_gan
stress_runs\20260120_084954\images\2026\09\20_seed41114.png,09/20/2026,2026-09-20,41114,B,handwriting_gan,pytorch_handwriting_gan
stress_runs\20260120_084954\images\2026\09\20_seed41115.png,09/20/2026,2026-09-20,41115,B,handwriting_gan,pytorch_handwriting_gan
stress_runs\20260120_084954\images\2026\09\21_seed41114.png,09/21/2026,2026-09-21,41114,B,handwriting_gan,pytorch_handwriting_gan
stress_runs\20260120_084954\images\2026\09\21_seed41115.png,09/21/2026,2026-09-21,41115,B,handwriting_gan,pytorch_handwriting_gan
stress_runs\20260120_084954\images\2026\09\21_seed41116.png,09/21/2026,2026-09-21,41116,B,handwriting_gan,pytorch_handwriting_gan
stress_runs\20260120_084954\images\2026\09\22_seed41115.png,09/22/2026,2026-09-22,41115,B,handwriting_gan,pytorch_handwriting_gan
stress_runs\20260120_084954\images\2026\09\22_seed41116.png,09/22/2026,2026-09-22,41116,B,handwriting_gan,pytorch_handwriting_gan
stress_runs\20260120_084954\images\2026\09\22_seed41117.png,09/22/2026,2026-09-22,41117,B,handwriting_gan,pytorch_handwriting_gan
stress_runs\20260120_084954\images\2026\09\23_seed41116.png,09/23/2026,2026-09-23,41116,B,handwriting_gan,pytorch_handwriting_gan
stress_runs\20260120_084954\images\2026\09\23_seed41117.png,09/23/2026,2026-09-23,41117,B,handwriting_gan,pytorch_handwriting_gan
stress_runs\20260120_084954\images\2026\09\23_seed41118.png,09/23/2026,2026-09-23,41118,B,handwriting_gan,pytorch_handwriting_gan
stress_runs\20260120_084954\images\2026\09\24_seed41117.png,09/24/2026,2026-09-24,41117,B,handwriting_gan,pytorch_handwriting_gan
stress_runs\20260120_084954\images\2026\09\24_seed41118.png,09/24/2026,2026-09-24,41118,B,handwriting_gan,pytorch_handwriting_gan
stress_runs\20260120_084954\images\2026\09\24_seed41119.png,09/24/2026,2026-09-24,41119,B,handwriting_gan,pytorch_handwriting_gan
stress_runs\20260120_084954\images\2026\09\25_seed41118.png,09/25/2026,2026-09-25,41118,B,handwriting_gan,pytorch_handwriting_gan
stress_runs\20260120_084954\images\2026\09\25_seed41119.png,09/25/2026,2026-09-25,41119,B,handwriting_gan,pytorch_handwriting_gan
stress_runs\20260120_084954\images\2026\09\25_seed41120.png,09/25/2026,2026-09-25,41120,B,handwriting_gan,pytorch_handwriting_gan
stress_runs\20260120_084954\images\2026\09\26_seed41119.png,09/26/2026,2026-09-26,41119,B,handwriting_gan,pytorch_handwriting_gan
stress_runs\20260120_084954\images\2026\09\26_seed41120.png,09/26/2026,2026-09-26,41120,B,handwriting_gan,pytorch_handwriting_gan
stress_runs\20260120_084954\images\2026\09\26_seed41121.png,09/26/2026,2026-09-26,41121,B,handwriting_gan,pytorch_handwriting_gan
stress_runs\20260120_084954\images\2026\09\27_seed41120.png,09/27/2026,2026-09-27,41120,B,handwriting_gan,pytorch_handwriting_gan
stress_runs\20260120_084954\images\2026\09\27_seed41121.png,09/27/2026,2026-09-27,41121,B,handwriting_gan,pytorch_handwriting_gan
stress_runs\20260120_084954\images\2026\09\27_seed41122.png,09/27/2026,2026-09-27,41122,B,handwriting_gan,pytorch_handwriting_gan
stress_runs\20260120_084954\images\2026\09\28_seed41121.png,09/28/2026,2026-09-28,41121,B,handwriting_gan,pytorch_handwriting_gan
stress_runs\20260120_084954\images\2026\09\28_seed41122.png,09/28/2026,2026-09-28,41122,B,handwriting_gan,pytorch_handwriting_gan
stress_runs\20260120_084954\images\2026\09\28_seed41123.png,09/28/2026,2026-09-28,41123,B,handwriting_gan,pytorch_handwriting_gan
stress_runs\20260120_084954\images\2026\09\29_seed41122.png,09/29/2026,2026-09-29,41122,B,handwriting_gan,pytorch_handwriting_gan
stress_runs\20260120_084954\images\2026\09\29_seed41123.png,09/29/2026,2026-09-29,41123,B,handwriting_gan,pytorch_handwriting_gan
stress_runs\20260120_084954\images\2026\09\29_seed41124.png,09/29/2026,2026-09-29,41124,B,handwriting_gan,pytorch_handwriting_gan
stress_runs\20260120_084954\images\2026\09\30_seed41123.png,09/30/2026,2026-09-30,41123,B,handwriting_gan,pytorch_handwriting_gan
stress_runs\20260120_084954\images\2026\09\30_seed41124.png,09/30/2026,2026-09-30,41124,B,handwriting_gan,pytorch_handwriting_gan
stress_runs\20260120_084954\images\2026\09\30_seed41125.png,09/30/2026,2026-09-30,41125,B,handwriting_gan,pytorch_handwriting_gan
stress_runs\20260120_084954\images\2026\10\01_seed41124.png,10/01/2026,2026-10-01,41124,B,handwriting_gan,pytorch_handwriting_gan
stress_runs\20260120_084954\images\2026\10\01_seed41125.png,10/01/2026,2026-10-01,41125,B,handwriting_gan,pytorch_handwriting_gan
stress_runs\20260120_084954\images\2026\10\01_seed41126.png,10/01/2026,2026-10-01,41126,B,handwriting_gan,pytorch_handwriting_gan
stress_runs\20260120_084954\images\2026\10\02_seed41125.png,10/02/2026,2026-10-02,41125,B,handwriting_gan,pytorch_handwriting_gan
stress_runs\20260120_084954\images\2026\10\02_seed41126.png,10/02/2026,2026-10-02,41126,B,handwriting_gan,pytorch_handwriting_gan
stress_runs\20260120_084954\images\2026\10\02_seed41127.png,10/02/2026,2026-10-02,41127,B,handwriting_gan,pytorch_handwriting_gan
